perf/model_parity_full/java/layout/realworld/ptolemy/hierarchical/ptides_actuatorpattern_ActuatorPattern1.elkt.json

{"id":"G1","children":[{"id":"N1","labels":[{"text":"Plant","id":"L1","x":0.0,"y":-20.0,"width":30.0,"height":15.0}],"ports":[{"id":"P1","layoutOptions":{"org.eclipse.elk.port.side":"SOUTH","org.eclipse.elk.port.index":"0"},"x":-8.0,"y":188.66666666666669,"width":8.0,"height":8.0},{"id":"P2","layoutOptions":{"org.eclipse.elk.port.side":"EAST","org.eclipse.elk.port.index":"1"},"x":740.0,"y":132.0,"width":8.0,"height":8.0},{"id":"P3","layoutOptions":{"org.eclipse.elk.port.side":"EAST","org.eclipse.elk.port.index":"2"},"x":740.0,"y":218.0,"width":8.0,"height":8.0}],"children":[{"id":"N2","labels":[{"text":"LevelCrossingDetector","id":"L2","x":0.0,"y":-20.0,"width":130.0,"height":15.0}],"ports":[{"id":"P4","layoutOptions":{"org.eclipse.elk.port.side":"EAST","org.eclipse.elk.port.index":"0"},"x":73.0,"y":19.0,"width":8.0,"height":8.0},{"id":"P5","layoutOptions":{"org.eclipse.elk.port.side":"WEST","org.eclipse.elk.port.index":"-1"},"x":-8.0,"y":19.0,"width":8.0,"height":8.0}],"layoutOptions":{"org.eclipse.elk.portConstraints":"FIXED_ORDER","org.eclipse.elk.nodeLabels.placement":"[H_LEFT, V_TOP, OUTSIDE]"},"x":598.0,"y":113.0,"width":73.0,"height":46.0},{"id":"N3","labels":[{"text":"ZeroOrderHold","id":"L3","x":0.0,"y":-20.0,"width":84.0,"height":15.0}],"ports":[{"id":"P6","layoutOptions":{"org.eclipse.elk.port.side":"WEST","org.eclipse.elk.port.index":"0"},"x":-8.0,"y":16.5,"width":8.0,"height":8.0},{"id":"P7","layoutOptions":{"org.eclipse.elk.port.side":"EAST","org.eclipse.elk.port.index":"1"},"x":61.0,"y":16.5,"width":8.0,"height":8.0}],"layoutOptions":{"org.eclipse.elk.portConstraints":"FIXED_ORDER","org.eclipse.elk.nodeLabels.placement":"[H_LEFT, V_TOP, OUTSIDE]"},"x":20.0,"y":172.16666666666669,"width":61.0,"height":41.0},{"id":"N4","labels":[{"text":"LevelCrossingDetector2","id":"L4","x":0.0,"y":-20.0,"width":137.0,"height":15.0}],"ports":[{"id":"P8","layoutOptions":{"org.eclipse.elk.port.side":"EAST","org.eclipse.elk.port.index":"0"},"x":73.0,"y":19.0,"width":8.0,"height":8.0},{"id":"P9","layoutOptions":{"org.eclipse.elk.port.side":"WEST","org.eclipse.elk.port.index":"-1"},"x":-8.0,"y":19.0,"width":8.0,"height":8.0}],"layoutOptions":{"org.eclipse.elk.portConstraints":"FIXED_ORDER","org.eclipse.elk.nodeLabels.placement":"[H_LEFT, V_TOP, OUTSIDE]"},"x":591.0,"y":199.0,"width":73.0,"height":46.0},{"id":"N5","labels":[{"text":"Const2","id":"L5","x":0.0,"y":-20.0,"width":42.0,"height":15.0}],"ports":[{"id":"P10","layoutOptions":{"org.eclipse.elk.port.side":"EAST","org.eclipse.elk.port.index":"0"},"x":44.0,"y":8.5,"width":8.0,"height":8.0},{"id":"P11","layoutOptions":{"org.eclipse.elk.port.side":"WEST","org.eclipse.elk.port.index":"-1"},"x":-8.0,"y":8.5,"width":8.0,"height":8.0}],"layoutOptions":{"org.eclipse.elk.portConstraints":"FIXED_ORDER","org.eclipse.elk.nodeLabels.placement":"[H_LEFT, V_TOP, OUTSIDE]"},"x":37.0,"y":107.16666666666667,"width":44.0,"height":25.0},{"id":"N6","labels":[{"text":"AddSubtract","id":"L6","x":0.0,"y":-20.0,"width":72.0,"height":15.0}],"ports":[{"id":"P12","layoutOptions":{"org.eclipse.elk.port.side":"WEST","org.eclipse.elk.port.index":"0"},"x":-8.0,"y":8.333333333333334,"width":8.0,"height":8.0},{"id":"P13","layoutOptions":{"org.eclipse.elk.port.side":"WEST","org.eclipse.elk.port.index":"-1"},"x":-8.0,"y":24.66666666666667,"width":8.0,"height":8.0},{"id":"P14","layoutOptions":{"org.eclipse.elk.port.side":"EAST","org.eclipse.elk.port.index":"2"},"x":41.0,"y":16.5,"width":8.0,"height":8.0}],"layoutOptions":{"org.eclipse.elk.portConstraints":"FIXED_ORDER","org.eclipse.elk.nodeLabels.placement":"[H_LEFT, V_TOP, OUTSIDE]"},"x":132.0,"y":107.33333333333334,"width":41.0,"height":41.0},{"id":"N7","labels":[{"text":"MultiplyDivide","id":"L7","x":0.0,"y":-20.0,"width":80.0,"height":15.0}],"ports":[{"id":"P15","layoutOptions":{"org.eclipse.elk.port.side":"WEST","org.eclipse.elk.port.index":"0"},"x":-8.0,"y":8.333333333333334,"width":8.0,"height":8.0},{"id":"P16","layoutOptions":{"org.eclipse.elk.port.side":"WEST","org.eclipse.elk.port.index":"-1"},"x":-8.0,"y":24.66666666666667,"width":8.0,"height":8.0},{"id":"P17","layoutOptions":{"org.eclipse.elk.port.side":"EAST","org.eclipse.elk.port.index":"2"},"x":41.0,"y":16.5,"width":8.0,"height":8.0}],"layoutOptions":{"org.eclipse.elk.portConstraints":"FIXED_ORDER","org.eclipse.elk.nodeLabels.placement":"[H_LEFT, V_TOP, OUTSIDE]"},"x":400.0,"y":115.5,"width":41.0,"height":41.0},{"id":"N8","labels":[{"text":"Const3","id":"L8","x":0.0,"y":-20.0,"width":42.0,"height":15.0}],"ports":[{"id":"P18","layoutOptions":{"org.eclipse.elk.port.side":"EAST","org.eclipse.elk.port.index":"0"},"x":132.0,"y":8.5,"width":8.0,"height":8.0},{"id":"P19","layoutOptions":{"org.eclipse.elk.port.side":"WEST","org.eclipse.elk.port.index":"-1"},"x":-8.0,"y":8.5,"width":8.0,"height":8.0}],"layoutOptions":{"org.eclipse.elk.portConstraints":"FIXED_ORDER","org.eclipse.elk.nodeLabels.placement":"[H_LEFT, V_TOP, OUTSIDE]"},"x":232.0,"y":158.83333333333334,"width":132.0,"height":25.0},{"id":"N9","labels":[{"text":"Integrator","id":"L9","x":0.0,"y":-20.0,"width":55.0,"height":15.0}],"ports":[{"id":"P20","layoutOptions":{"org.eclipse.elk.port.side":"SOUTH","org.eclipse.elk.port.index":"0"},"x":9.333333333333334,"y":46.0,"width":8.0,"height":8.0},{"id":"P21","layoutOptions":{"org.eclipse.elk.port.side":"WEST","org.eclipse.elk.port.index":"-1"},"x":-8.0,"y":19.0,"width":8.0,"height":8.0},{"id":"P22","layoutOptions":{"org.eclipse.elk.port.side":"EAST","org.eclipse.elk.port.index":"2"},"x":44.0,"y":19.0,"width":8.0,"height":8.0},{"id":"P23","layoutOptions":{"org.eclipse.elk.port.side":"SOUTH","org.eclipse.elk.port.index":"-3"},"x":26.66666666666667,"y":46.0,"width":8.0,"height":8.0}],"layoutOptions":{"org.eclipse.elk.portConstraints":"FIXED_ORDER","org.eclipse.elk.nodeLabels.placement":"[H_LEFT, V_TOP, OUTSIDE]"},"x":508.0,"y":113.0,"width":44.0,"height":46.0},{"id":"N10","labels":[{"text":"TimedPlotter","id":"L10","x":0.0,"y":-20.0,"width":74.0,"height":15.0}],"ports":[{"id":"P24","layoutOptions":{"org.eclipse.elk.port.side":"WEST","org.eclipse.elk.port.index":"0"},"x":-8.0,"y":16.5,"width":8.0,"height":8.0}],"layoutOptions":{"org.eclipse.elk.portConstraints":"FIXED_ORDER","org.eclipse.elk.nodeLabels.placement":"[H_LEFT, V_TOP, OUTSIDE]"},"x":591.0,"y":32.0,"width":41.0,"height":41.0}],"layoutOptions":{"org.eclipse.elk.portConstraints":"FREE","org.eclipse.elk.nodeLabels.placement":"[H_LEFT, V_TOP, OUTSIDE]"},"x":30.0,"y":42.0,"width":740.0,"height":257.0,"edges":[{"id":"E4","sources":["P1"],"targets":["P6"],"sections":[{"id":"E4_s0","startPoint":{"x":0.0,"y":192.66666666666669},"endPoint":{"x":12.0,"y":192.66666666666669},"incomingShape":"P1","outgoingShape":"P6"}],"container":"N1"},{"id":"E5","sources":["P4"],"targets":["P2"],"sections":[{"id":"E5_s0","startPoint":{"x":679.0,"y":136.0},"endPoint":{"x":740.0,"y":136.0},"incomingShape":"P4","outgoingShape":"P2"}],"container":"N1"},{"id":"E6","sources":["P7"],"targets":["P13"],"sections":[{"id":"E6_s0","startPoint":{"x":89.0,"y":192.66666666666669},"endPoint":{"x":124.0,"y":136.0},"bendPoints":[{"x":114.0,"y":192.66666666666669},{"x":114.0,"y":136.0}],"incomingShape":"P7","outgoingShape":"P13"}],"container":"N1"},{"id":"E7","sources":["P8"],"targets":["P3"],"sections":[{"id":"E7_s0","startPoint":{"x":672.0,"y":222.0},"endPoint":{"x":740.0,"y":222.0},"incomingShape":"P8","outgoingShape":"P3"}],"container":"N1"},{"id":"E8","sources":["P10"],"targets":["P12"],"sections":[{"id":"E8_s0","startPoint":{"x":89.0,"y":119.66666666666667},"endPoint":{"x":124.0,"y":119.66666666666667},"incomingShape":"P10","outgoingShape":"P12"}],"container":"N1"},{"id":"E9","sources":["P14"],"targets":["P15"],"sections":[{"id":"E9_s0","startPoint":{"x":181.0,"y":127.83333333333334},"endPoint":{"x":392.0,"y":127.83333333333333},"incomingShape":"P14","outgoingShape":"P15"}],"container":"N1"},{"id":"E10","sources":["P14"],"targets":["P19"],"sections":[{"id":"E10_s0","startPoint":{"x":181.0,"y":127.83333333333334},"endPoint":{"x":224.0,"y":171.33333333333334},"bendPoints":[{"x":214.0,"y":127.83333333333334},{"x":214.0,"y":171.33333333333334}],"incomingShape":"P14","outgoingShape":"P19"}],"junctionPoints":[{"x":214.0,"y":127.83333333333334}],"container":"N1"},{"id":"E11","sources":["P17"],"targets":["P21"],"sections":[{"id":"E11_s0","startPoint":{"x":449.0,"y":136.0},"endPoint":{"x":500.0,"y":136.0},"incomingShape":"P17","outgoingShape":"P21"}],"container":"N1"},{"id":"E12","sources":["P18"],"targets":["P16"],"sections":[{"id":"E12_s0","startPoint":{"x":372.0,"y":171.33333333333334},"endPoint":{"x":392.0,"y":144.16666666666669},"bendPoints":[{"x":382.0,"y":171.33333333333334},{"x":382.0,"y":144.16666666666669}],"incomingShape":"P18","outgoingShape":"P16"}],"container":"N1"},{"id":"E13","sources":["P22"],"targets":["P5"],"sections":[{"id":"E13_s0","startPoint":{"x":560.0,"y":136.0},"endPoint":{"x":590.0,"y":136.0},"incomingShape":"P22","outgoingShape":"P5"}],"container":"N1"},{"id":"E14","sources":["P22"],"targets":["P9"],"sections":[{"id":"E14_s0","startPoint":{"x":560.0,"y":136.0},"endPoint":{"x":583.0,"y":222.0},"bendPoints":[{"x":573.0,"y":136.0},{"x":573.0,"y":222.0}],"incomingShape":"P22","outgoingShape":"P9"}],"junctionPoints":[{"x":573.0,"y":136.0}],"container":"N1"},{"id":"E15","sources":["P22"],"targets":["P24"],"sections":[{"id":"E15_s0","startPoint":{"x":560.0,"y":136.0},"endPoint":{"x":583.0,"y":52.5},"bendPoints":[{"x":573.0,"y":136.0},{"x":573.0,"y":52.5}],"incomingShape":"P22","outgoingShape":"P24"}],"container":"N1"}]},{"id":"N11","labels":[{"text":"PtidesPlatform","id":"L11","x":0.0,"y":-20.0,"width":85.0,"height":15.0}],"ports":[{"id":"P25","layoutOptions":{"org.eclipse.elk.port.side":"WEST","org.eclipse.elk.port.index":"0"},"x":-8.0,"y":89.0,"width":8.0,"height":8.0},{"id":"P26","layoutOptions":{"org.eclipse.elk.port.side":"WEST","org.eclipse.elk.port.index":"-1"},"x":-8.0,"y":137.5,"width":8.0,"height":8.0},{"id":"P27","layoutOptions":{"org.eclipse.elk.port.side":"EAST","org.eclipse.elk.port.index":"2"},"x":-8.0,"y":40.5,"width":8.0,"height":8.0}],"children":[{"id":"N12","labels":[{"text":"PtidesPlatformContents","id":"L12","x":0.0,"y":-20.0,"width":137.0,"height":15.0}],"ports":[{"id":"P28","layoutOptions":{"org.eclipse.elk.port.side":"WEST","org.eclipse.elk.port.index":"0"},"x":-8.0,"y":113.5,"width":8.0,"height":8.0},{"id":"P29","layoutOptions":{"org.eclipse.elk.port.side":"WEST","org.eclipse.elk.port.index":"-1"},"x":-8.0,"y":48.5,"width":8.0,"height":8.0},{"id":"P30","layoutOptions":{"org.eclipse.elk.port.side":"EAST","org.eclipse.elk.port.index":"2"},"x":148.0,"y":48.5,"width":8.0,"height":8.0}],"children":[{"id":"N13","labels":[{"text":"Const","id":"L13","x":0.0,"y":-20.0,"width":34.0,"height":15.0}],"ports":[{"id":"P31","layoutOptions":{"org.eclipse.elk.port.side":"EAST","org.eclipse.elk.port.index":"0"},"x":43.0,"y":8.5,"width":8.0,"height":8.0},{"id":"P32","layoutOptions":{"org.eclipse.elk.port.side":"WEST","org.eclipse.elk.port.index":"-1"},"x":-8.0,"y":8.5,"width":8.0,"height":8.0}],"layoutOptions":{"org.eclipse.elk.portConstraints":"FIXED_ORDER","org.eclipse.elk.nodeLabels.placement":"[H_LEFT, V_TOP, OUTSIDE]"},"x":20.0,"y":105.0,"width":43.0,"height":25.0},{"id":"N14","labels":[{"text":"Merge","id":"L14","x":0.0,"y":-20.0,"width":37.0,"height":15.0}],"ports":[{"id":"P33","layoutOptions":{"org.eclipse.elk.port.side":"WEST","org.eclipse.elk.port.index":"0"},"x":-8.0,"y":16.5,"width":8.0,"height":8.0},{"id":"P34","layoutOptions":{"org.eclipse.elk.port.side":"EAST","org.eclipse.elk.port.index":"1"},"x":21.0,"y":16.5,"width":8.0,"height":8.0}],"layoutOptions":{"org.eclipse.elk.portConstraints":"FIXED_ORDER","org.eclipse.elk.nodeLabels.placement":"[H_LEFT, V_TOP, OUTSIDE]"},"x":99.0,"y":32.0,"width":21.0,"height":41.0},{"id":"N15","labels":[{"text":"Const2","id":"L15","x":0.0,"y":-20.0,"width":42.0,"height":15.0}],"ports":[{"id":"P35","layoutOptions":{"org.eclipse.elk.port.side":"EAST","org.eclipse.elk.port.index":"0"},"x":29.0,"y":8.5,"width":8.0,"height":8.0},{"id":"P36","layoutOptions":{"org.eclipse.elk.port.side":"WEST","org.eclipse.elk.port.index":"-1"},"x":-8.0,"y":8.5,"width":8.0,"height":8.0}],"layoutOptions":{"org.eclipse.elk.portConstraints":"FIXED_ORDER","org.eclipse.elk.nodeLabels.placement":"[H_LEFT, V_TOP, OUTSIDE]"},"x":27.0,"y":40.0,"width":29.0,"height":25.0}],"layoutOptions":{"org.eclipse.elk.portConstraints":"FREE","org.eclipse.elk.nodeLabels.placement":"[H_LEFT, V_TOP, OUTSIDE]"},"x":20.0,"y":32.0,"width":148.0,"height":142.0,"edges":[{"id":"E16","sources":["P28"],"targets":["P32"],"sections":[{"id":"E16_s0","startPoint":{"x":0.0,"y":117.5},"endPoint":{"x":12.0,"y":117.5},"incomingShape":"P28","outgoingShape":"P32"}],"container":"N12"},{"id":"E17","sources":["P29"],"targets":["P36"],"sections":[{"id":"E17_s0","startPoint":{"x":0.0,"y":52.5},"endPoint":{"x":19.0,"y":52.5},"incomingShape":"P29","outgoingShape":"P36"}],"container":"N12"},{"id":"E18","sources":["P31"],"targets":["P33"],"sections":[{"id":"E18_s0","startPoint":{"x":71.0,"y":117.5},"endPoint":{"x":91.0,"y":52.5},"bendPoints":[{"x":81.0,"y":117.5},{"x":81.0,"y":52.5}],"incomingShape":"P31","outgoingShape":"P33"}],"junctionPoints":[{"x":81.0,"y":52.5}],"container":"N12"},{"id":"E19","sources":["P34"],"targets":["P30"],"sections":[{"id":"E19_s0","startPoint":{"x":128.0,"y":52.5},"endPoint":{"x":148.0,"y":52.5},"incomingShape":"P34","outgoingShape":"P30"}],"container":"N12"},{"id":"E20","sources":["P35"],"targets":["P33"],"sections":[{"id":"E20_s0","startPoint":{"x":64.0,"y":52.5},"endPoint":{"x":91.0,"y":52.5},"incomingShape":"P35","outgoingShape":"P33"}],"container":"N12"}]}],"layoutOptions":{"org.eclipse.elk.portConstraints":"FREE","org.eclipse.elk.nodeLabels.placement":"[H_LEFT, V_TOP, OUTSIDE]"},"x":806.0,"y":85.0,"width":188.0,"height":186.0}],"layoutOptions":{"org.eclipse.elk.portConstraints":"FREE","org.eclipse.elk.randomSeed":"1"},"x":0.0,"y":0.0,"width":1006.0,"height":311.0,"edges":[{"id":"E1","sources":["P2"],"targets":["P25"],"sections":[{"id":"E1_s0","startPoint":{"x":778.0,"y":178.0},"endPoint":{"x":798.0,"y":178.0},"incomingShape":"P2","outgoingShape":"P25"}],"container":"G1"},{"id":"E2","sources":["P3"],"targets":["P26"],"sections":[{"id":"E2_s0","startPoint":{"x":778.0,"y":264.0},"endPoint":{"x":798.0,"y":226.5},"bendPoints":[{"x":788.0,"y":264.0},{"x":788.0,"y":226.5}],"incomingShape":"P3","outgoingShape":"P26"}],"container":"G1"},{"id":"E3","sources":["P27"],"targets":["P1"],"sections":[{"id":"E3_s0","startPoint":{"x":798.0,"y":129.5},"endPoint":{"x":22.0,"y":234.66666666666669},"bendPoints":[{"x":788.0,"y":129.5},{"x":788.0,"y":12.0},{"x":12.0,"y":12.0},{"x":12.0,"y":234.66666666666669}],"incomingShape":"P27","outgoingShape":"P1"}],"container":"G1"}]}

perf/model_parity_tickets/report.md

## Drift Samples

- `tickets/core/056_portLabelPlacement.elkt`: diffs=2 [coordinate=2], first: children[0]/ports[0]/y: number mismatch (55.0 != 35.0)
- `tickets/core/299_surroundingPortSpace.elkt`: diffs=1 [coordinate=1], first: children[0]/height: number mismatch (40.0 != 20.0)
- `tickets/core/491_portSpacing.elkt`: diffs=4 [coordinate=2, section=2], first: children[0]/ports[1]/y: number mismatch (37.0 != 38.0)
- `tickets/core/562_insideSelfLoopAlgorithmResolving.elkt`: diffs=6 [coordinate=3, section=3], first: children[0]/ports[0]/y: number mismatch (12.0 != 0.0)
- `tickets/layered/079_selfLoopLabels.elkt`: diffs=1 [ordering=1], first: edges[0]/sections[0]/bendPoints: array length mismatch (4 != 2)
- `tickets/layered/082_unfortunateEdgeLabelSideSelection.elkt`: diffs=20 [section=14, label=4, coordinate=2], first: children[1]/x: number mismatch (15.0 != 12.0)
- `tickets/layered/128_selfLoopLabelSpacing_complex.elkt`: diffs=20 [section=10, label=7, coordinate=3], first: children[0]/y: number mismatch (192.0 != 120.0)
- `tickets/layered/128_selfLoopLabelSpacing_simple.elkt`: diffs=7 [section=4, coordinate=1, label=1, other=1], first: children[0]/y: number mismatch (52.0 != 34.0)
- `tickets/layered/167_insidePortLabelsInHierarchicalGraphs.elkt`: diffs=4 [coordinate=2, section=1, other=1], first: children[1]/edges[1]/sections[0]/endPoint/x: number mismatch (4.0 != 24.0)
- `tickets/layered/193_hierarchicalPortOverlaps.elkt`: diffs=7 [coordinate=4, structure=1, section=1, other=1], first: children[0]/edges[0]/sections[0]: missing keys on right: bendPoints
- `tickets/layered/194_excessiveWhiteSpace.elkt`: diffs=20 [section=9, coordinate=8, ordering=2, structure=1], first: children[0]/children[0]/y: number mismatch (153.0 != 72.0)
- `tickets/layered/213_componentsCompaction.elkt`: diffs=20 [coordinate=20], first: children[0]/children[0]/x: number mismatch (12.5 != 12.0)
- `tickets/layered/273_insideSelfLoopsWithLabels.elkt`: diffs=15 [coordinate=7, section=4, label=2, other=2], first: children[0]/children[0]/ports[0]/x: number mismatch (0.0 != -20.0)
- `tickets/layered/288_selfLoopsCauseNPE_a.elkt`: diffs=17 [section=9, coordinate=5, other=2, ordering=1], first: children[0]/y: number mismatch (24.0 != 49.0)
- `tickets/layered/288_selfLoopsCauseNPE_b.elkt`: diffs=20 [section=11, coordinate=7, ordering=1, structure=1], first: children[0]/children[0]/children[0]/y: number mismatch (22.0 != 32.0)
- `tickets/layered/297_sameSideInsideSelfLoop.elkt`: diffs=11 [coordinate=4, section=4, other=2, structure=1], first: children[0]/height: number mismatch (74.0 != 100.0)
- `tickets/layered/298_selfLoopsCauseAIOOBE.elkt`: diffs=14 [coordinate=7, section=4, other=2, structure=1], first: children[0]/height: number mismatch (44.0 != 100.0)
- `tickets/layered/302_brokenSplineSelfLoops.elkt`: diffs=6 [section=2, other=2, coordinate=1, ordering=1], first: children[0]/x: number mismatch (23.333333333333332 != 27.0)
- `tickets/layered/304_wrongMinimumNodeSize.elkt`: diffs=20 [coordinate=10, section=8, structure=2], first: children[0]/y: number mismatch (47.0 != 12.0)
- `tickets/layered/308_hyperedgeMerging.elkt`: diffs=17 [section=12, coordinate=2, structure=1, ordering=1, other=1], first: children[1]/y: number mismatch (23.0 != 33.0)