perf/model_parity_full/java/layout/realworld/ptolemy/hierarchical/ddf_randomwalk_RandomWalk.elkt.json

{"id":"G1","children":[{"id":"N1","labels":[{"text":"Uniform","id":"L1","x":0.0,"y":-20.0,"width":44.0,"height":15.0}],"ports":[{"id":"P1","layoutOptions":{"org.eclipse.elk.port.side":"EAST","org.eclipse.elk.port.index":"0"},"x":67.0,"y":19.0,"width":8.0,"height":8.0},{"id":"P2","layoutOptions":{"org.eclipse.elk.port.side":"WEST","org.eclipse.elk.port.index":"-1"},"x":-8.0,"y":5.5,"width":8.0,"height":8.0},{"id":"P3","layoutOptions":{"org.eclipse.elk.port.side":"WEST","org.eclipse.elk.port.index":"-2"},"x":-8.0,"y":19.0,"width":8.0,"height":8.0},{"id":"P4","layoutOptions":{"org.eclipse.elk.port.side":"WEST","org.eclipse.elk.port.index":"-3"},"x":-8.0,"y":32.5,"width":8.0,"height":8.0}],"layoutOptions":{"org.eclipse.elk.portConstraints":"FIXED_ORDER","org.eclipse.elk.nodeLabels.placement":"[H_LEFT, V_TOP, OUTSIDE]"},"x":20.0,"y":43.83333333333334,"width":67.0,"height":46.0},{"id":"N2","labels":[{"text":"Uniform2","id":"L2","x":0.0,"y":-20.0,"width":52.0,"height":15.0}],"ports":[{"id":"P5","layoutOptions":{"org.eclipse.elk.port.side":"EAST","org.eclipse.elk.port.index":"0"},"x":67.0,"y":19.0,"width":8.0,"height":8.0},{"id":"P6","layoutOptions":{"org.eclipse.elk.port.side":"WEST","org.eclipse.elk.port.index":"-1"},"x":-8.0,"y":5.5,"width":8.0,"height":8.0},{"id":"P7","layoutOptions":{"org.eclipse.elk.port.side":"WEST","org.eclipse.elk.port.index":"-2"},"x":-8.0,"y":19.0,"width":8.0,"height":8.0},{"id":"P8","layoutOptions":{"org.eclipse.elk.port.side":"WEST","org.eclipse.elk.port.index":"-3"},"x":-8.0,"y":32.5,"width":8.0,"height":8.0}],"layoutOptions":{"org.eclipse.elk.portConstraints":"FIXED_ORDER","org.eclipse.elk.nodeLabels.placement":"[H_LEFT, V_TOP, OUTSIDE]"},"x":20.0,"y":129.83333333333334,"width":67.0,"height":46.0},{"id":"N3","labels":[{"text":"TrigFunction2","id":"L3","x":0.0,"y":-20.0,"width":79.0,"height":15.0}],"ports":[{"id":"P9","layoutOptions":{"org.eclipse.elk.port.side":"WEST","org.eclipse.elk.port.index":"0"},"x":-8.0,"y":8.5,"width":8.0,"height":8.0},{"id":"P10","layoutOptions":{"org.eclipse.elk.port.side":"EAST","org.eclipse.elk.port.index":"1"},"x":14.0,"y":8.5,"width":8.0,"height":8.0}],"layoutOptions":{"org.eclipse.elk.portConstraints":"FIXED_ORDER","org.eclipse.elk.nodeLabels.placement":"[H_LEFT, V_TOP, OUTSIDE]"},"x":250.0,"y":188.83333333333334,"width":14.0,"height":25.0},{"id":"N4","labels":[{"text":"DrawLine","id":"L4","x":0.0,"y":-20.0,"width":54.0,"height":15.0}],"ports":[{"id":"P11","layoutOptions":{"org.eclipse.elk.port.side":"WEST","org.eclipse.elk.port.index":"0"},"x":-8.0,"y":12.0,"width":8.0,"height":8.0},{"id":"P12","layoutOptions":{"org.eclipse.elk.port.side":"WEST","org.eclipse.elk.port.index":"-1"},"x":-8.0,"y":100.33333333333334,"width":8.0,"height":8.0},{"id":"P13","layoutOptions":{"org.eclipse.elk.port.side":"WEST","org.eclipse.elk.port.index":"-2"},"x":-8.0,"y":186.33333333333334,"width":8.0,"height":8.0}],"children":[{"id":"N5","labels":[{"text":"Repeat","id":"L5","x":0.0,"y":-20.0,"width":41.0,"height":15.0}],"ports":[{"id":"P14","layoutOptions":{"org.eclipse.elk.port.side":"WEST","org.eclipse.elk.port.index":"0"},"x":-8.0,"y":19.0,"width":8.0,"height":8.0},{"id":"P15","layoutOptions":{"org.eclipse.elk.port.side":"EAST","org.eclipse.elk.port.index":"1"},"x":66.0,"y":19.0,"width":8.0,"height":8.0}],"layoutOptions":{"org.eclipse.elk.portConstraints":"FIXED_ORDER","org.eclipse.elk.nodeLabels.placement":"[H_LEFT, V_TOP, OUTSIDE]"},"x":20.0,"y":81.33333333333334,"width":66.0,"height":46.0},{"id":"N6","labels":[{"text":"Repeat2","id":"L6","x":0.0,"y":-20.0,"width":49.0,"height":15.0}],"ports":[{"id":"P16","layoutOptions":{"org.eclipse.elk.port.side":"WEST","org.eclipse.elk.port.index":"0"},"x":-8.0,"y":19.0,"width":8.0,"height":8.0},{"id":"P17","layoutOptions":{"org.eclipse.elk.port.side":"EAST","org.eclipse.elk.port.index":"1"},"x":66.0,"y":19.0,"width":8.0,"height":8.0}],"layoutOptions":{"org.eclipse.elk.portConstraints":"FIXED_ORDER","org.eclipse.elk.nodeLabels.placement":"[H_LEFT, V_TOP, OUTSIDE]"},"x":20.0,"y":167.33333333333334,"width":66.0,"height":46.0},{"id":"N7","labels":[{"text":"DisplayLine","id":"L7","x":0.0,"y":-20.0,"width":68.0,"height":15.0}],"ports":[{"id":"P18","layoutOptions":{"org.eclipse.elk.port.side":"WEST","org.eclipse.elk.port.index":"0"},"x":-8.0,"y":40.333333333333336,"width":8.0,"height":8.0},{"id":"P19","layoutOptions":{"org.eclipse.elk.port.side":"WEST","org.eclipse.elk.port.index":"-1"},"x":-8.0,"y":121.33333333333334,"width":8.0,"height":8.0}],"children":[{"id":"N8","labels":[{"text":"Accumulator","id":"L8","x":0.0,"y":-20.0,"width":74.0,"height":15.0}],"ports":[{"id":"P20","layoutOptions":{"org.eclipse.elk.port.side":"WEST","org.eclipse.elk.port.index":"0"},"x":-8.0,"y":8.333333333333334,"width":8.0,"height":8.0},{"id":"P21","layoutOptions":{"org.eclipse.elk.port.side":"EAST","org.eclipse.elk.port.index":"1"},"x":41.0,"y":16.5,"width":8.0,"height":8.0},{"id":"P22","layoutOptions":{"org.eclipse.elk.port.side":"WEST","org.eclipse.elk.port.index":"-2"},"x":-8.0,"y":24.66666666666667,"width":8.0,"height":8.0}],"layoutOptions":{"org.eclipse.elk.portConstraints":"FIXED_ORDER","org.eclipse.elk.nodeLabels.placement":"[H_LEFT, V_TOP, OUTSIDE]"},"x":27.0,"y":32.0,"width":41.0,"height":41.0},{"id":"N9","labels":[{"text":"Accumulator2","id":"L9","x":0.0,"y":-20.0,"width":81.0,"height":15.0}],"ports":[{"id":"P23","layoutOptions":{"org.eclipse.elk.port.side":"WEST","org.eclipse.elk.port.index":"0"},"x":-8.0,"y":8.333333333333334,"width":8.0,"height":8.0},{"id":"P24","layoutOptions":{"org.eclipse.elk.port.side":"EAST","org.eclipse.elk.port.index":"1"},"x":41.0,"y":16.5,"width":8.0,"height":8.0},{"id":"P25","layoutOptions":{"org.eclipse.elk.port.side":"WEST","org.eclipse.elk.port.index":"-2"},"x":-8.0,"y":24.66666666666667,"width":8.0,"height":8.0}],"layoutOptions":{"org.eclipse.elk.portConstraints":"FIXED_ORDER","org.eclipse.elk.nodeLabels.placement":"[H_LEFT, V_TOP, OUTSIDE]"},"x":20.0,"y":113.0,"width":41.0,"height":41.0},{"id":"N10","labels":[{"text":"XYPlotter","id":"L10","x":0.0,"y":-20.0,"width":55.0,"height":15.0}],"ports":[{"id":"P26","layoutOptions":{"org.eclipse.elk.port.side":"WEST","org.eclipse.elk.port.index":"0"},"x":-8.0,"y":8.333333333333334,"width":8.0,"height":8.0},{"id":"P27","layoutOptions":{"org.eclipse.elk.port.side":"WEST","org.eclipse.elk.port.index":"-1"},"x":-8.0,"y":24.66666666666667,"width":8.0,"height":8.0}],"layoutOptions":{"org.eclipse.elk.portConstraints":"FIXED_ORDER","org.eclipse.elk.nodeLabels.placement":"[H_LEFT, V_TOP, OUTSIDE]"},"x":129.0,"y":40.16666666666667,"width":41.0,"height":41.0}],"layoutOptions":{"org.eclipse.elk.portConstraints":"FREE","org.eclipse.elk.nodeLabels.placement":"[H_LEFT, V_TOP, OUTSIDE]"},"x":122.0,"y":60.0,"width":196.0,"height":166.0,"edges":[{"id":"E13","sources":["P18"],"targets":["P20"],"sections":[{"id":"E13_s0","startPoint":{"x":0.0,"y":44.333333333333336},"endPoint":{"x":19.0,"y":44.333333333333336},"incomingShape":"P18","outgoingShape":"P20"}],"container":"N7"},{"id":"E14","sources":["P19"],"targets":["P23"],"sections":[{"id":"E14_s0","startPoint":{"x":0.0,"y":125.33333333333334},"endPoint":{"x":12.0,"y":125.33333333333333},"incomingShape":"P19","outgoingShape":"P23"}],"container":"N7"},{"id":"E15","sources":["P21"],"targets":["P26"],"sections":[{"id":"E15_s0","startPoint":{"x":76.0,"y":52.5},"endPoint":{"x":121.0,"y":52.5},"incomingShape":"P21","outgoingShape":"P26"}],"container":"N7"},{"id":"E16","sources":["P24"],"targets":["P27"],"sections":[{"id":"E16_s0","startPoint":{"x":69.0,"y":133.5},"endPoint":{"x":121.0,"y":68.83333333333334},"bendPoints":[{"x":111.0,"y":133.5},{"x":111.0,"y":68.83333333333334}],"incomingShape":"P24","outgoingShape":"P27"}],"container":"N7"}]}],"layoutOptions":{"org.eclipse.elk.portConstraints":"FREE","org.eclipse.elk.nodeLabels.placement":"[H_LEFT, V_TOP, OUTSIDE]"},"x":357.0,"y":32.0,"width":330.0,"height":238.0,"edges":[{"id":"E9","sources":["P12"],"targets":["P14"],"sections":[{"id":"E9_s0","startPoint":{"x":0.0,"y":104.33333333333334},"endPoint":{"x":12.0,"y":104.33333333333334},"incomingShape":"P12","outgoingShape":"P14"}],"container":"N4"},{"id":"E10","sources":["P13"],"targets":["P16"],"sections":[{"id":"E10_s0","startPoint":{"x":0.0,"y":190.33333333333334},"endPoint":{"x":12.0,"y":190.33333333333334},"incomingShape":"P13","outgoingShape":"P16"}],"container":"N4"},{"id":"E11","sources":["P15"],"targets":["P18"],"sections":[{"id":"E11_s0","startPoint":{"x":94.0,"y":104.33333333333334},"endPoint":{"x":114.0,"y":104.33333333333334},"incomingShape":"P15","outgoingShape":"P18"}],"container":"N4"},{"id":"E12","sources":["P17"],"targets":["P19"],"sections":[{"id":"E12_s0","startPoint":{"x":94.0,"y":190.33333333333334},"endPoint":{"x":114.0,"y":185.33333333333334},"bendPoints":[{"x":104.0,"y":190.33333333333334},{"x":104.0,"y":185.33333333333334}],"incomingShape":"P17","outgoingShape":"P19"}],"container":"N4"}]},{"id":"N11","labels":[{"text":"CartesianToPolar","id":"L11","x":0.0,"y":-20.0,"width":99.0,"height":15.0}],"ports":[{"id":"P28","layoutOptions":{"org.eclipse.elk.port.side":"WEST","org.eclipse.elk.port.index":"0"},"x":-8.0,"y":5.0,"width":8.0,"height":8.0},{"id":"P29","layoutOptions":{"org.eclipse.elk.port.side":"WEST","org.eclipse.elk.port.index":"-1"},"x":-8.0,"y":18.0,"width":8.0,"height":8.0},{"id":"P30","layoutOptions":{"org.eclipse.elk.port.side":"EAST","org.eclipse.elk.port.index":"2"},"x":31.0,"y":5.0,"width":8.0,"height":8.0},{"id":"P31","layoutOptions":{"org.eclipse.elk.port.side":"EAST","org.eclipse.elk.port.index":"3"},"x":31.0,"y":18.0,"width":8.0,"height":8.0}],"layoutOptions":{"org.eclipse.elk.portConstraints":"FIXED_ORDER","org.eclipse.elk.nodeLabels.placement":"[H_LEFT, V_TOP, OUTSIDE]"},"x":123.0,"y":57.83333333333334,"width":31.0,"height":31.0},{"id":"N12","labels":[{"text":"TrigFunction","id":"L12","x":0.0,"y":-20.0,"width":72.0,"height":15.0}],"ports":[{"id":"P32","layoutOptions":{"org.eclipse.elk.port.side":"WEST","org.eclipse.elk.port.index":"0"},"x":-8.0,"y":8.5,"width":8.0,"height":8.0},{"id":"P33","layoutOptions":{"org.eclipse.elk.port.side":"EAST","org.eclipse.elk.port.index":"1"},"x":31.0,"y":8.5,"width":8.0,"height":8.0}],"layoutOptions":{"org.eclipse.elk.portConstraints":"FIXED_ORDER","org.eclipse.elk.nodeLabels.placement":"[H_LEFT, V_TOP, OUTSIDE]"},"x":257.0,"y":123.83333333333334,"width":31.0,"height":25.0},{"id":"N13","labels":[{"text":"Ceil","id":"L13","x":0.0,"y":-20.0,"width":22.0,"height":15.0}],"ports":[{"id":"P34","layoutOptions":{"org.eclipse.elk.port.side":"WEST","org.eclipse.elk.port.index":"0"},"x":-8.0,"y":13.0,"width":8.0,"height":8.0},{"id":"P35","layoutOptions":{"org.eclipse.elk.port.side":"EAST","org.eclipse.elk.port.index":"1"},"x":34.0,"y":13.0,"width":8.0,"height":8.0}],"layoutOptions":{"org.eclipse.elk.portConstraints":"FIXED_ORDER","org.eclipse.elk.nodeLabels.placement":"[H_LEFT, V_TOP, OUTSIDE]"},"x":268.5,"y":49.83333333333334,"width":34.0,"height":34.0}],"layoutOptions":{"org.eclipse.elk.portConstraints":"FREE","org.eclipse.elk.randomSeed":"1"},"x":0.0,"y":0.0,"width":699.0,"height":282.0,"edges":[{"id":"E1","sources":["P1"],"targets":["P28"],"sections":[{"id":"E1_s0","startPoint":{"x":95.0,"y":66.83333333333334},"endPoint":{"x":115.0,"y":66.83333333333334},"incomingShape":"P1","outgoingShape":"P28"}],"container":"G1"},{"id":"E2","sources":["P5"],"targets":["P29"],"sections":[{"id":"E2_s0","startPoint":{"x":95.0,"y":152.83333333333334},"endPoint":{"x":115.0,"y":79.83333333333334},"bendPoints":[{"x":105.0,"y":152.83333333333334},{"x":105.0,"y":79.83333333333334}],"incomingShape":"P5","outgoingShape":"P29"}],"container":"G1"},{"id":"E3","sources":["P10"],"targets":["P13"],"sections":[{"id":"E3_s0","startPoint":{"x":272.0,"y":201.33333333333334},"endPoint":{"x":349.0,"y":222.33333333333334},"bendPoints":[{"x":339.0,"y":201.33333333333334},{"x":339.0,"y":222.33333333333334}],"incomingShape":"P10","outgoingShape":"P13"}],"container":"G1"},{"id":"E4","sources":["P31"],"targets":["P9"],"sections":[{"id":"E4_s0","startPoint":{"x":162.0,"y":79.83333333333334},"endPoint":{"x":242.0,"y":201.33333333333334},"bendPoints":[{"x":232.0,"y":79.83333333333334},{"x":232.0,"y":201.33333333333334}],"incomingShape":"P31","outgoingShape":"P9"}],"container":"G1"},{"id":"E5","sources":["P31"],"targets":["P32"],"sections":[{"id":"E5_s0","startPoint":{"x":162.0,"y":79.83333333333334},"endPoint":{"x":249.0,"y":136.33333333333334},"bendPoints":[{"x":232.0,"y":79.83333333333334},{"x":232.0,"y":136.33333333333334}],"incomingShape":"P31","outgoingShape":"P32"}],"junctionPoints":[{"x":232.0,"y":136.33333333333334}],"container":"G1"},{"id":"E6","sources":["P30"],"targets":["P34"],"sections":[{"id":"E6_s0","startPoint":{"x":162.0,"y":66.83333333333334},"endPoint":{"x":260.5,"y":66.83333333333334},"incomingShape":"P30","outgoingShape":"P34"}],"container":"G1"},{"id":"E7","sources":["P33"],"targets":["P12"],"sections":[{"id":"E7_s0","startPoint":{"x":296.0,"y":136.33333333333334},"endPoint":{"x":349.0,"y":136.33333333333334},"incomingShape":"P33","outgoingShape":"P12"}],"container":"G1"},{"id":"E8","sources":["P35"],"targets":["P11"],"sections":[{"id":"E8_s0","startPoint":{"x":310.5,"y":66.83333333333334},"endPoint":{"x":349.0,"y":48.0},"bendPoints":[{"x":339.0,"y":66.83333333333334},{"x":339.0,"y":48.0}],"incomingShape":"P35","outgoingShape":"P11"}],"container":"G1"}]}

perf/model_parity_tickets/report.md

## Drift Samples

- `tickets/core/056_portLabelPlacement.elkt`: diffs=2 [coordinate=2], first: children[0]/ports[0]/y: number mismatch (55.0 != 35.0)
- `tickets/core/299_surroundingPortSpace.elkt`: diffs=1 [coordinate=1], first: children[0]/height: number mismatch (40.0 != 20.0)
- `tickets/core/491_portSpacing.elkt`: diffs=4 [coordinate=2, section=2], first: children[0]/ports[1]/y: number mismatch (37.0 != 38.0)
- `tickets/core/562_insideSelfLoopAlgorithmResolving.elkt`: diffs=6 [coordinate=3, section=3], first: children[0]/ports[0]/y: number mismatch (12.0 != 0.0)
- `tickets/layered/079_selfLoopLabels.elkt`: diffs=1 [ordering=1], first: edges[0]/sections[0]/bendPoints: array length mismatch (4 != 2)
- `tickets/layered/082_unfortunateEdgeLabelSideSelection.elkt`: diffs=20 [section=14, label=4, coordinate=2], first: children[1]/x: number mismatch (15.0 != 12.0)
- `tickets/layered/128_selfLoopLabelSpacing_complex.elkt`: diffs=20 [section=10, label=7, coordinate=3], first: children[0]/y: number mismatch (192.0 != 120.0)
- `tickets/layered/128_selfLoopLabelSpacing_simple.elkt`: diffs=7 [section=4, coordinate=1, label=1, other=1], first: children[0]/y: number mismatch (52.0 != 34.0)
- `tickets/layered/167_insidePortLabelsInHierarchicalGraphs.elkt`: diffs=4 [coordinate=2, section=1, other=1], first: children[1]/edges[1]/sections[0]/endPoint/x: number mismatch (4.0 != 24.0)
- `tickets/layered/193_hierarchicalPortOverlaps.elkt`: diffs=7 [coordinate=4, structure=1, section=1, other=1], first: children[0]/edges[0]/sections[0]: missing keys on right: bendPoints
- `tickets/layered/194_excessiveWhiteSpace.elkt`: diffs=20 [section=9, coordinate=8, ordering=2, structure=1], first: children[0]/children[0]/y: number mismatch (153.0 != 72.0)
- `tickets/layered/213_componentsCompaction.elkt`: diffs=20 [coordinate=20], first: children[0]/children[0]/x: number mismatch (12.5 != 12.0)
- `tickets/layered/273_insideSelfLoopsWithLabels.elkt`: diffs=15 [coordinate=7, section=4, label=2, other=2], first: children[0]/children[0]/ports[0]/x: number mismatch (0.0 != -20.0)
- `tickets/layered/288_selfLoopsCauseNPE_a.elkt`: diffs=17 [section=9, coordinate=5, other=2, ordering=1], first: children[0]/y: number mismatch (24.0 != 49.0)
- `tickets/layered/288_selfLoopsCauseNPE_b.elkt`: diffs=20 [section=11, coordinate=7, ordering=1, structure=1], first: children[0]/children[0]/children[0]/y: number mismatch (22.0 != 32.0)
- `tickets/layered/297_sameSideInsideSelfLoop.elkt`: diffs=11 [coordinate=4, section=4, other=2, structure=1], first: children[0]/height: number mismatch (74.0 != 100.0)
- `tickets/layered/298_selfLoopsCauseAIOOBE.elkt`: diffs=14 [coordinate=7, section=4, other=2, structure=1], first: children[0]/height: number mismatch (44.0 != 100.0)
- `tickets/layered/302_brokenSplineSelfLoops.elkt`: diffs=6 [section=2, other=2, coordinate=1, ordering=1], first: children[0]/x: number mismatch (23.333333333333332 != 27.0)
- `tickets/layered/304_wrongMinimumNodeSize.elkt`: diffs=20 [coordinate=10, section=8, structure=2], first: children[0]/y: number mismatch (47.0 != 12.0)
- `tickets/layered/308_hyperedgeMerging.elkt`: diffs=17 [section=12, coordinate=2, structure=1, ordering=1, other=1], first: children[1]/y: number mismatch (23.0 != 33.0)