perf/model_parity_full/java/layout/realworld/ptolemy/flattened/ptides_errorhandling_ErrorHandling.elkg.json

{"id":"G1","children":[{"id":"N1","labels":[{"text":"SetVariable","id":"L1","x":0.0,"y":-20.0,"width":67.0,"height":15.0}],"ports":[{"id":"P1","layoutOptions":{"org.eclipse.elk.port.side":"WEST","org.eclipse.elk.port.index":"0"},"x":-8.0,"y":16.5,"width":8.0,"height":8.0},{"id":"P2","layoutOptions":{"org.eclipse.elk.port.side":"EAST","org.eclipse.elk.port.index":"1"},"x":61.0,"y":16.5,"width":8.0,"height":8.0}],"layoutOptions":{"org.eclipse.elk.portConstraints":"FIXED_ORDER","org.eclipse.elk.nodeLabels.placement":"[H_LEFT, V_TOP, OUTSIDE]"},"x":120.0,"y":34.5,"width":61.0,"height":41.0},{"id":"N2","labels":[{"text":"InitializeDelay","id":"L2","x":0.0,"y":-20.0,"width":80.0,"height":15.0}],"ports":[{"id":"P3","layoutOptions":{"org.eclipse.elk.port.side":"EAST","org.eclipse.elk.port.index":"0"},"x":66.0,"y":19.0,"width":8.0,"height":8.0}],"layoutOptions":{"org.eclipse.elk.portConstraints":"FIXED_ORDER","org.eclipse.elk.nodeLabels.placement":"[H_LEFT, V_TOP, OUTSIDE]"},"x":12.0,"y":32.0,"width":66.0,"height":46.0},{"id":"N3","labels":[{"text":"missedN2","id":"L3","x":0.0,"y":-20.0,"width":59.0,"height":15.0}],"ports":[{"id":"P4","layoutOptions":{"org.eclipse.elk.port.side":"EAST","org.eclipse.elk.port.index":"0"},"x":33.0,"y":8.5,"width":8.0,"height":8.0},{"id":"P5","layoutOptions":{"org.eclipse.elk.port.side":"WEST","org.eclipse.elk.port.index":"-1"},"x":-8.0,"y":8.5,"width":8.0,"height":8.0}],"layoutOptions":{"org.eclipse.elk.portConstraints":"FIXED_ORDER","org.eclipse.elk.nodeLabels.placement":"[H_LEFT, V_TOP, OUTSIDE]"},"x":20.0,"y":296.5,"width":33.0,"height":25.0},{"id":"N4","labels":[{"text":"ErrorHandlingAction","id":"L4","x":0.0,"y":-20.0,"width":116.0,"height":15.0}],"ports":[{"id":"P6","layoutOptions":{"org.eclipse.elk.port.side":"WEST","org.eclipse.elk.port.index":"0"},"x":-8.0,"y":16.0,"width":8.0,"height":8.0}],"layoutOptions":{"org.eclipse.elk.portConstraints":"FIXED_ORDER","org.eclipse.elk.nodeLabels.placement":"[H_LEFT, V_TOP, OUTSIDE]"},"x":117.0,"y":289.0,"width":60.0,"height":40.0},{"id":"N5","labels":[{"text":"Counter","id":"L5","x":0.0,"y":-20.0,"width":46.0,"height":15.0}],"ports":[{"id":"P7","layoutOptions":{"org.eclipse.elk.port.side":"WEST","org.eclipse.elk.port.index":"0"},"x":-8.0,"y":8.333333333333334,"width":8.0,"height":8.0},{"id":"P8","layoutOptions":{"org.eclipse.elk.port.side":"WEST","org.eclipse.elk.port.index":"-1"},"x":-8.0,"y":24.66666666666667,"width":8.0,"height":8.0},{"id":"P9","layoutOptions":{"org.eclipse.elk.port.side":"EAST","org.eclipse.elk.port.index":"2"},"x":61.0,"y":16.5,"width":8.0,"height":8.0}],"layoutOptions":{"org.eclipse.elk.portConstraints":"FIXED_ORDER","org.eclipse.elk.nodeLabels.placement":"[H_LEFT, V_TOP, OUTSIDE]"},"x":132.33333333333334,"y":208.0,"width":61.0,"height":41.0},{"id":"N6","labels":[{"text":"Comparator","id":"L6","x":0.0,"y":-20.0,"width":68.0,"height":15.0}],"ports":[{"id":"P10","layoutOptions":{"org.eclipse.elk.port.side":"WEST","org.eclipse.elk.port.index":"0"},"x":-8.0,"y":5.0,"width":8.0,"height":8.0},{"id":"P11","layoutOptions":{"org.eclipse.elk.port.side":"WEST","org.eclipse.elk.port.index":"-1"},"x":-8.0,"y":18.0,"width":8.0,"height":8.0},{"id":"P12","layoutOptions":{"org.eclipse.elk.port.side":"EAST","org.eclipse.elk.port.index":"2"},"x":61.0,"y":11.5,"width":8.0,"height":8.0}],"layoutOptions":{"org.eclipse.elk.portConstraints":"FIXED_ORDER","org.eclipse.elk.nodeLabels.placement":"[H_LEFT, V_TOP, OUTSIDE]"},"x":323.0,"y":206.5,"width":61.0,"height":31.0},{"id":"N7","labels":[{"text":"Const","id":"L7","x":0.0,"y":-20.0,"width":34.0,"height":15.0}],"ports":[{"id":"P13","layoutOptions":{"org.eclipse.elk.port.side":"EAST","org.eclipse.elk.port.index":"0"},"x":18.0,"y":8.5,"width":8.0,"height":8.0},{"id":"P14","layoutOptions":{"org.eclipse.elk.port.side":"WEST","org.eclipse.elk.port.index":"-1"},"x":-8.0,"y":8.5,"width":8.0,"height":8.0}],"layoutOptions":{"org.eclipse.elk.portConstraints":"FIXED_ORDER","org.eclipse.elk.nodeLabels.placement":"[H_LEFT, V_TOP, OUTSIDE]"},"x":261.0,"y":216.0,"width":18.0,"height":25.0},{"id":"N8","labels":[{"text":"TrueGate","id":"L8","x":0.0,"y":-20.0,"width":54.0,"height":15.0}],"ports":[{"id":"P15","layoutOptions":{"org.eclipse.elk.port.side":"WEST","org.eclipse.elk.port.index":"0"},"x":-8.0,"y":11.5,"width":8.0,"height":8.0},{"id":"P16","layoutOptions":{"org.eclipse.elk.port.side":"EAST","org.eclipse.elk.port.index":"1"},"x":41.0,"y":11.5,"width":8.0,"height":8.0}],"layoutOptions":{"org.eclipse.elk.portConstraints":"FIXED_ORDER","org.eclipse.elk.nodeLabels.placement":"[H_LEFT, V_TOP, OUTSIDE]"},"x":420.0,"y":206.5,"width":41.0,"height":31.0},{"id":"N9","labels":[{"text":"SetVariable","id":"L9","x":0.0,"y":-20.0,"width":67.0,"height":15.0}],"ports":[{"id":"P17","layoutOptions":{"org.eclipse.elk.port.side":"WEST","org.eclipse.elk.port.index":"0"},"x":-8.0,"y":16.5,"width":8.0,"height":8.0},{"id":"P18","layoutOptions":{"org.eclipse.elk.port.side":"EAST","org.eclipse.elk.port.index":"1"},"x":61.0,"y":16.5,"width":8.0,"height":8.0}],"layoutOptions":{"org.eclipse.elk.portConstraints":"FIXED_ORDER","org.eclipse.elk.nodeLabels.placement":"[H_LEFT, V_TOP, OUTSIDE]"},"x":673.0,"y":126.0,"width":61.0,"height":41.0},{"id":"N10","labels":[{"text":"Expression","id":"L10","x":0.0,"y":-20.0,"width":66.0,"height":15.0}],"ports":[{"id":"P19","layoutOptions":{"org.eclipse.elk.port.side":"EAST","org.eclipse.elk.port.index":"0"},"x":135.0,"y":8.5,"width":8.0,"height":8.0},{"id":"P20","layoutOptions":{"org.eclipse.elk.port.side":"WEST","org.eclipse.elk.port.index":"-1"},"x":-8.0,"y":8.5,"width":8.0,"height":8.0}],"layoutOptions":{"org.eclipse.elk.portConstraints":"FIXED_ORDER","org.eclipse.elk.nodeLabels.placement":"[H_LEFT, V_TOP, OUTSIDE]"},"x":502.0,"y":134.0,"width":135.0,"height":25.0},{"id":"N11","labels":[{"text":"Repeat","id":"L11","x":0.0,"y":-20.0,"width":41.0,"height":15.0}],"ports":[{"id":"P21","layoutOptions":{"org.eclipse.elk.port.side":"WEST","org.eclipse.elk.port.index":"0"},"x":-8.0,"y":19.0,"width":8.0,"height":8.0},{"id":"P22","layoutOptions":{"org.eclipse.elk.port.side":"EAST","org.eclipse.elk.port.index":"1"},"x":66.0,"y":19.0,"width":8.0,"height":8.0}],"layoutOptions":{"org.eclipse.elk.portConstraints":"FIXED_ORDER","org.eclipse.elk.nodeLabels.placement":"[H_LEFT, V_TOP, OUTSIDE]"},"x":536.5,"y":199.0,"width":66.0,"height":46.0},{"id":"N12","labels":[{"text":"MicrostepDelay","id":"L12","x":0.0,"y":-20.0,"width":90.0,"height":15.0}],"ports":[{"id":"P23","layoutOptions":{"org.eclipse.elk.port.side":"WEST","org.eclipse.elk.port.index":"0"},"x":-8.0,"y":10.0,"width":8.0,"height":8.0},{"id":"P24","layoutOptions":{"org.eclipse.elk.port.side":"EAST","org.eclipse.elk.port.index":"1"},"x":31.0,"y":10.0,"width":8.0,"height":8.0}],"layoutOptions":{"org.eclipse.elk.portConstraints":"FIXED_ORDER","org.eclipse.elk.nodeLabels.placement":"[H_LEFT, V_TOP, OUTSIDE]"},"x":673.0,"y":208.0,"width":31.0,"height":28.0},{"id":"N13","labels":[{"text":"AddSubtract","id":"L13","x":0.0,"y":-20.0,"width":72.0,"height":15.0}],"ports":[{"id":"P25","layoutOptions":{"org.eclipse.elk.port.side":"WEST","org.eclipse.elk.port.index":"0"},"x":-8.0,"y":8.333333333333334,"width":8.0,"height":8.0},{"id":"P26","layoutOptions":{"org.eclipse.elk.port.side":"WEST","org.eclipse.elk.port.index":"-1"},"x":-8.0,"y":24.66666666666667,"width":8.0,"height":8.0},{"id":"P27","layoutOptions":{"org.eclipse.elk.port.side":"EAST","org.eclipse.elk.port.index":"2"},"x":41.0,"y":16.5,"width":8.0,"height":8.0}],"layoutOptions":{"org.eclipse.elk.portConstraints":"FIXED_ORDER","org.eclipse.elk.nodeLabels.placement":"[H_LEFT, V_TOP, OUTSIDE]"},"x":455.0,"y":34.5,"width":41.0,"height":41.0},{"id":"N14","labels":[{"text":"TimeDelay","id":"L14","x":0.0,"y":-20.0,"width":61.0,"height":15.0}],"ports":[{"id":"P28","layoutOptions":{"org.eclipse.elk.port.side":"WEST","org.eclipse.elk.port.index":"0"},"x":-8.0,"y":19.0,"width":8.0,"height":8.0},{"id":"P29","layoutOptions":{"org.eclipse.elk.port.side":"EAST","org.eclipse.elk.port.index":"1"},"x":66.0,"y":19.0,"width":8.0,"height":8.0},{"id":"P30","layoutOptions":{"org.eclipse.elk.port.side":"SOUTH","org.eclipse.elk.port.index":"-2"},"x":29.0,"y":46.0,"width":8.0,"height":8.0}],"layoutOptions":{"org.eclipse.elk.portConstraints":"FIXED_ORDER","org.eclipse.elk.nodeLabels.placement":"[H_LEFT, V_TOP, OUTSIDE]"},"x":555.0,"y":32.0,"width":66.0,"height":46.0},{"id":"N15","labels":[{"text":"missedN2","id":"L15","x":0.0,"y":-20.0,"width":59.0,"height":15.0}],"ports":[{"id":"P31","layoutOptions":{"org.eclipse.elk.port.side":"EAST","org.eclipse.elk.port.index":"0"},"x":33.0,"y":8.5,"width":8.0,"height":8.0},{"id":"P32","layoutOptions":{"org.eclipse.elk.port.side":"WEST","org.eclipse.elk.port.index":"-1"},"x":-8.0,"y":8.5,"width":8.0,"height":8.0}],"layoutOptions":{"org.eclipse.elk.portConstraints":"FIXED_ORDER","org.eclipse.elk.nodeLabels.placement":"[H_LEFT, V_TOP, OUTSIDE]"},"x":217.0,"y":39.5,"width":33.0,"height":25.0},{"id":"N16","labels":[{"text":"ErrorHandlingAction2","id":"L16","x":0.0,"y":-20.0,"width":123.0,"height":15.0}],"ports":[{"id":"P33","layoutOptions":{"org.eclipse.elk.port.side":"WEST","org.eclipse.elk.port.index":"0"},"x":-8.0,"y":16.0,"width":8.0,"height":8.0}],"layoutOptions":{"org.eclipse.elk.portConstraints":"FIXED_ORDER","org.eclipse.elk.nodeLabels.placement":"[H_LEFT, V_TOP, OUTSIDE]"},"x":304.0,"y":32.0,"width":60.0,"height":40.0}],"layoutOptions":{"org.eclipse.elk.portConstraints":"FREE","org.eclipse.elk.randomSeed":"1"},"x":0.0,"y":0.0,"width":785.0,"height":341.0,"edges":[{"id":"E1","sources":["P3"],"targets":["P1"],"sections":[{"id":"E1_s0","startPoint":{"x":86.0,"y":55.0},"endPoint":{"x":112.0,"y":55.0},"incomingShape":"P3","outgoingShape":"P1"}],"container":"G1"},{"id":"E2","sources":["P4"],"targets":["P6"],"sections":[{"id":"E2_s0","startPoint":{"x":61.0,"y":309.0},"endPoint":{"x":109.0,"y":309.0},"incomingShape":"P4","outgoingShape":"P6"}],"container":"G1"},{"id":"E3","sources":["P4"],"targets":["P7"],"sections":[{"id":"E3_s0","startPoint":{"x":61.0,"y":309.0},"endPoint":{"x":124.33333333333334,"y":220.33333333333334},"bendPoints":[{"x":89.0,"y":309.0},{"x":89.0,"y":220.33333333333334}],"incomingShape":"P4","outgoingShape":"P7"}],"junctionPoints":[{"x":89.0,"y":309.0}],"container":"G1"},{"id":"E4","sources":["P9"],"targets":["P10"],"sections":[{"id":"E4_s0","startPoint":{"x":201.33333333333334,"y":228.5},"endPoint":{"x":315.0,"y":215.5},"bendPoints":[{"x":243.0,"y":228.5},{"x":243.0,"y":185.0},{"x":305.0,"y":185.0},{"x":305.0,"y":215.5}],"incomingShape":"P9","outgoingShape":"P10"}],"junctionPoints":[{"x":243.0,"y":228.5}],"container":"G1"},{"id":"E5","sources":["P9"],"targets":["P14"],"sections":[{"id":"E5_s0","startPoint":{"x":201.33333333333334,"y":228.5},"endPoint":{"x":253.0,"y":228.5},"incomingShape":"P9","outgoingShape":"P14"}],"container":"G1"},{"id":"E6","sources":["P12"],"targets":["P15"],"sections":[{"id":"E6_s0","startPoint":{"x":392.0,"y":222.0},"endPoint":{"x":412.0,"y":222.0},"incomingShape":"P12","outgoingShape":"P15"}],"container":"G1"},{"id":"E7","sources":["P13"],"targets":["P11"],"sections":[{"id":"E7_s0","startPoint":{"x":287.0,"y":228.5},"endPoint":{"x":315.0,"y":228.5},"incomingShape":"P13","outgoingShape":"P11"}],"container":"G1"},{"id":"E8","sources":["P16"],"targets":["P20"],"sections":[{"id":"E8_s0","startPoint":{"x":469.0,"y":222.0},"endPoint":{"x":494.0,"y":146.5},"bendPoints":[{"x":484.0,"y":222.0},{"x":484.0,"y":146.5}],"incomingShape":"P16","outgoingShape":"P20"}],"junctionPoints":[{"x":484.0,"y":222.0}],"container":"G1"},{"id":"E9","sources":["P16"],"targets":["P21"],"sections":[{"id":"E9_s0","startPoint":{"x":469.0,"y":222.0},"endPoint":{"x":528.5,"y":222.0},"incomingShape":"P16","outgoingShape":"P21"}],"container":"G1"},{"id":"E10","sources":["P19"],"targets":["P17"],"sections":[{"id":"E10_s0","startPoint":{"x":645.0,"y":146.5},"endPoint":{"x":665.0,"y":146.5},"incomingShape":"P19","outgoingShape":"P17"}],"container":"G1"},{"id":"E11","sources":["P22"],"targets":["P23"],"sections":[{"id":"E11_s0","startPoint":{"x":610.5,"y":222.0},"endPoint":{"x":665.0,"y":222.0},"incomingShape":"P22","outgoingShape":"P23"}],"container":"G1"},{"id":"E12","sources":["P24"],"targets":["P8"],"sections":[{"id":"E12_s0","startPoint":{"x":712.0,"y":222.0},"endPoint":{"x":124.33333333333334,"y":236.66666666666669},"bendPoints":[{"x":773.0,"y":222.0},{"x":773.0,"y":259.0},{"x":99.0,"y":259.0},{"x":99.0,"y":236.66666666666669}],"incomingShape":"P24","outgoingShape":"P8"}],"container":"G1"},{"id":"E13","sources":["P27"],"targets":["P28"],"sections":[{"id":"E13_s0","startPoint":{"x":504.0,"y":55.0},"endPoint":{"x":547.0,"y":55.0},"incomingShape":"P27","outgoingShape":"P28"}],"container":"G1"},{"id":"E14","sources":["P31"],"targets":["P33"],"sections":[{"id":"E14_s0","startPoint":{"x":258.0,"y":52.0},"endPoint":{"x":296.0,"y":52.0},"incomingShape":"P31","outgoingShape":"P33"}],"container":"G1"}]}

perf/model_parity/report.md

## Drift Samples

- `examples/hierarchy/hierarchicalEdges.elkt`: diffs=9 [coordinate=6, other=2, structure=1], first: children[0]/children[0]/x: number mismatch (17.0 != 12.0)
- `examples/hierarchy/hierarchicalLayoutMixing.elkt`: diffs=20 [coordinate=10, section=8, structure=2], first: children[0]/children[0]/x: number mismatch (17.0 != 44.558860981188595)
- `examples/labels/portLabelsMulti.elkt`: diffs=4 [label=4], first: children[1]/ports[2]/labels[0]/y: number mismatch (1.0 != -31.0)
- `examples/user-hints/interactive-constraints/interactiveLayeredLayout_circle.elkt`: diffs=18 [section=12, coordinate=4, structure=1, other=1], first: children[0]/y: number mismatch (12.0 != 17.5)
- `examples/user-hints/interactive-constraints/interactiveLayeredLayout_hierarchyDirection.elkt`: diffs=20 [section=12, coordinate=7, structure=1], first: children[0]/x: number mismatch (52.0 != 62.0)
- `examples/user-hints/interactive-constraints/interactiveLayeredLayout_hierarchyDirection_pseudo_positions.elkt`: diffs=20 [section=12, coordinate=7, structure=1], first: children[0]/x: number mismatch (52.0 != 62.0)
- `examples/user-hints/interactive-constraints/interactiveLayeredLayout_hierarchy_pseudo_positions.elkt`: diffs=8 [coordinate=4, section=4], first: children[0]/x: number mismatch (76.0 != 12.0)
- `examples/user-hints/interactive-constraints/interactiveLayeredLayout_motor.elkt`: diffs=20 [section=11, coordinate=9], first: children[0]/x: number mismatch (82.0 != 72.0)
- `examples/user-hints/interactive-constraints/interactiveLayeredLayout_separateComponents_pseudo_positions.elkt`: diffs=8 [coordinate=3, section=3, other=2], first: children[0]/y: number mismatch (32.0 != 12.0)
- `examples/user-hints/interactive-constraints/interactiveLayeredLayout_simpleDirectionTest.elkt`: diffs=16 [section=12, coordinate=4], first: children[0]/y: number mismatch (12.0 != 32.0)
- `examples/user-hints/interactive-constraints/interactiveLayeredLayout_simpleDirectionTest_pseudo_positions.elkt`: diffs=16 [section=12, coordinate=4], first: children[0]/y: number mismatch (12.0 != 32.0)
- `examples/user-hints/interactive-constraints/interactiveLayeredLayout_snake_pseudo_positions.elkt`: diffs=20 [coordinate=20], first: children[1]/x: number mismatch (132.0 != 192.0)
- `examples/user-hints/interactive-constraints/interactiveLayeredLayout_sortingTask.elkt`: diffs=20 [section=10, coordinate=9, structure=1], first: children[0]/x: number mismatch (62.0 != 72.0)
- `examples/user-hints/interactive-constraints/interactiveLayeredLayout_sortingTask_pseudo_positions.elkt`: diffs=20 [coordinate=12, section=6, structure=2], first: children[0]/x: number mismatch (12.0 != 82.0)
- `examples/user-hints/interactive-constraints/interactiveLayout_mixedHierarchy.elkt`: diffs=8 [coordinate=6, other=2], first: children[0]/x: number mismatch (15.0 != 12.0)
- `examples/user-hints/interactive-constraints/interactiveRectpacking_hierarchy.elkt`: diffs=12 [coordinate=10, other=2], first: children[0]/x: number mismatch (15.0 != 12.0)
- `examples/user-hints/interactive-constraints/interactiveRectpacking_oneBigNode.elkt`: diffs=16 [coordinate=14, other=2], first: children[0]/x: number mismatch (15.0 != 12.0)
- `examples/user-hints/layered/horizontalOrder.elkt`: diffs=20 [coordinate=10, section=8, structure=2], first: children[1]/children[0]/x: number mismatch (32.0 != 12.0)
- `examples/user-hints/layered/partitioning.elkt`: diffs=20 [coordinate=18, section=2], first: children[0]/children[0]/y: number mismatch (86.0 != 96.0)
- `examples/user-hints/layered/reverseEdge.elkt`: diffs=20 [section=12, coordinate=6, structure=2], first: children[0]/children[0]/x: number mismatch (52.0 != 72.0)