perf/model_parity_full/java/layout/realworld/ptolemy/flattened/backtrack_ramprollback_RampRollback.elkt.json

{"id":"G1","children":[{"id":"N1","labels":[{"text":"SingleEvent","id":"L1","x":0.0,"y":-20.0,"width":68.0,"height":15.0}],"ports":[{"id":"P1","layoutOptions":{"org.eclipse.elk.port.side":"EAST","org.eclipse.elk.port.index":"0"},"x":66.0,"y":19.0,"width":8.0,"height":8.0}],"layoutOptions":{"org.eclipse.elk.portConstraints":"FIXED_ORDER","org.eclipse.elk.nodeLabels.placement":"[H_LEFT, V_TOP, OUTSIDE]"},"x":24.0,"y":46.0,"width":66.0,"height":46.0},{"id":"N2","labels":[{"text":"Backtrack","id":"L2","x":0.0,"y":-20.0,"width":59.0,"height":15.0}],"ports":[{"id":"P2","layoutOptions":{"org.eclipse.elk.port.side":"WEST","org.eclipse.elk.port.index":"0"},"x":-8.0,"y":8.0,"width":8.0,"height":8.0},{"id":"P3","layoutOptions":{"org.eclipse.elk.port.side":"WEST","org.eclipse.elk.port.index":"-1"},"x":-8.0,"y":24.0,"width":8.0,"height":8.0},{"id":"P4","layoutOptions":{"org.eclipse.elk.port.side":"EAST","org.eclipse.elk.port.index":"2"},"x":60.0,"y":16.0,"width":8.0,"height":8.0}],"layoutOptions":{"org.eclipse.elk.portConstraints":"FIXED_ORDER","org.eclipse.elk.nodeLabels.placement":"[H_LEFT, V_TOP, OUTSIDE]"},"x":232.0,"y":57.0,"width":60.0,"height":40.0},{"id":"N3","labels":[{"text":"Const","id":"L3","x":0.0,"y":-20.0,"width":34.0,"height":15.0}],"ports":[{"id":"P5","layoutOptions":{"org.eclipse.elk.port.side":"EAST","org.eclipse.elk.port.index":"0"},"x":33.0,"y":8.5,"width":8.0,"height":8.0},{"id":"P6","layoutOptions":{"org.eclipse.elk.port.side":"WEST","org.eclipse.elk.port.index":"-1"},"x":-8.0,"y":8.5,"width":8.0,"height":8.0}],"layoutOptions":{"org.eclipse.elk.portConstraints":"FIXED_ORDER","org.eclipse.elk.nodeLabels.placement":"[H_LEFT, V_TOP, OUTSIDE]"},"x":144.5,"y":56.5,"width":33.0,"height":25.0},{"id":"N4","labels":[{"text":"Ramp","id":"L4","x":0.0,"y":-20.0,"width":35.0,"height":15.0}],"ports":[{"id":"P7","layoutOptions":{"org.eclipse.elk.port.side":"EAST","org.eclipse.elk.port.index":"0"},"x":60.0,"y":16.0,"width":8.0,"height":8.0},{"id":"P8","layoutOptions":{"org.eclipse.elk.port.side":"WEST","org.eclipse.elk.port.index":"-1"},"x":-8.0,"y":16.0,"width":8.0,"height":8.0}],"layoutOptions":{"org.eclipse.elk.portConstraints":"FIXED_ORDER","org.eclipse.elk.nodeLabels.placement":"[H_LEFT, V_TOP, OUTSIDE]"},"x":30.0,"y":254.5,"width":60.0,"height":40.0},{"id":"N5","labels":[{"text":"Merge","id":"L5","x":0.0,"y":-20.0,"width":37.0,"height":15.0}],"ports":[{"id":"P9","layoutOptions":{"org.eclipse.elk.port.side":"WEST","org.eclipse.elk.port.index":"0"},"x":-8.0,"y":16.5,"width":8.0,"height":8.0},{"id":"P10","layoutOptions":{"org.eclipse.elk.port.side":"EAST","org.eclipse.elk.port.index":"1"},"x":21.0,"y":16.5,"width":8.0,"height":8.0}],"layoutOptions":{"org.eclipse.elk.portConstraints":"FIXED_ORDER","org.eclipse.elk.nodeLabels.placement":"[H_LEFT, V_TOP, OUTSIDE]"},"x":528.0,"y":56.5,"width":21.0,"height":41.0},{"id":"N6","labels":[{"text":"Register","id":"L6","x":0.0,"y":-20.0,"width":49.0,"height":15.0}],"ports":[{"id":"P11","layoutOptions":{"org.eclipse.elk.port.side":"WEST","org.eclipse.elk.port.index":"0"},"x":-8.0,"y":16.5,"width":8.0,"height":8.0},{"id":"P12","layoutOptions":{"org.eclipse.elk.port.side":"EAST","org.eclipse.elk.port.index":"1"},"x":21.0,"y":16.5,"width":8.0,"height":8.0},{"id":"P13","layoutOptions":{"org.eclipse.elk.port.side":"SOUTH","org.eclipse.elk.port.index":"-2"},"x":6.5,"y":41.0,"width":8.0,"height":8.0}],"layoutOptions":{"org.eclipse.elk.portConstraints":"FIXED_ORDER","org.eclipse.elk.nodeLabels.placement":"[H_LEFT, V_TOP, OUTSIDE]"},"x":347.0,"y":56.5,"width":21.0,"height":41.0},{"id":"N7","labels":[{"text":"Expression","id":"L7","x":0.0,"y":-20.0,"width":66.0,"height":15.0}],"ports":[{"id":"P14","layoutOptions":{"org.eclipse.elk.port.side":"EAST","org.eclipse.elk.port.index":"0"},"x":70.0,"y":8.5,"width":8.0,"height":8.0},{"id":"P15","layoutOptions":{"org.eclipse.elk.port.side":"WEST","org.eclipse.elk.port.index":"-1"},"x":-8.0,"y":8.5,"width":8.0,"height":8.0}],"layoutOptions":{"org.eclipse.elk.portConstraints":"FIXED_ORDER","org.eclipse.elk.nodeLabels.placement":"[H_LEFT, V_TOP, OUTSIDE]"},"x":126.0,"y":262.0,"width":70.0,"height":25.0},{"id":"N8","labels":[{"text":"BooleanSwitch","id":"L8","x":0.0,"y":-20.0,"width":87.0,"height":15.0}],"ports":[{"id":"P16","layoutOptions":{"org.eclipse.elk.port.side":"WEST","org.eclipse.elk.port.index":"0"},"x":-8.0,"y":19.0,"width":8.0,"height":8.0},{"id":"P17","layoutOptions":{"org.eclipse.elk.port.side":"SOUTH","org.eclipse.elk.port.index":"-1"},"x":15.5,"y":46.0,"width":8.0,"height":8.0},{"id":"P18","layoutOptions":{"org.eclipse.elk.port.side":"EAST","org.eclipse.elk.port.index":"2"},"x":39.0,"y":10.0,"width":8.0,"height":8.0},{"id":"P19","layoutOptions":{"org.eclipse.elk.port.side":"EAST","org.eclipse.elk.port.index":"3"},"x":39.0,"y":28.0,"width":8.0,"height":8.0}],"layoutOptions":{"org.eclipse.elk.portConstraints":"FIXED_ORDER","org.eclipse.elk.nodeLabels.placement":"[H_LEFT, V_TOP, OUTSIDE]"},"x":232.0,"y":137.0,"width":39.0,"height":46.0},{"id":"N9","labels":[{"text":"Display","id":"L9","x":0.0,"y":-20.0,"width":43.0,"height":15.0}],"ports":[{"id":"P20","layoutOptions":{"org.eclipse.elk.port.side":"WEST","org.eclipse.elk.port.index":"0"},"x":-8.0,"y":11.5,"width":8.0,"height":8.0}],"layoutOptions":{"org.eclipse.elk.portConstraints":"FIXED_ORDER","org.eclipse.elk.nodeLabels.placement":"[H_LEFT, V_TOP, OUTSIDE]"},"x":126.0,"y":191.0,"width":41.0,"height":31.0},{"id":"N10","labels":[{"text":"TimedDelay","id":"L10","x":0.0,"y":-20.0,"width":68.0,"height":15.0}],"ports":[{"id":"P21","layoutOptions":{"org.eclipse.elk.port.side":"WEST","org.eclipse.elk.port.index":"0"},"x":-8.0,"y":19.0,"width":8.0,"height":8.0},{"id":"P22","layoutOptions":{"org.eclipse.elk.port.side":"EAST","org.eclipse.elk.port.index":"1"},"x":66.0,"y":19.0,"width":8.0,"height":8.0}],"layoutOptions":{"org.eclipse.elk.portConstraints":"FIXED_ORDER","org.eclipse.elk.nodeLabels.placement":"[H_LEFT, V_TOP, OUTSIDE]"},"x":425.0,"y":146.0,"width":66.0,"height":46.0},{"id":"N11","labels":[{"text":"TimedDelay2","id":"L11","x":0.0,"y":-20.0,"width":76.0,"height":15.0}],"ports":[{"id":"P23","layoutOptions":{"org.eclipse.elk.port.side":"WEST","org.eclipse.elk.port.index":"0"},"x":-8.0,"y":19.0,"width":8.0,"height":8.0},{"id":"P24","layoutOptions":{"org.eclipse.elk.port.side":"EAST","org.eclipse.elk.port.index":"1"},"x":66.0,"y":19.0,"width":8.0,"height":8.0}],"layoutOptions":{"org.eclipse.elk.portConstraints":"FIXED_ORDER","org.eclipse.elk.nodeLabels.placement":"[H_LEFT, V_TOP, OUTSIDE]"},"x":424.0,"y":54.0,"width":66.0,"height":46.0}],"layoutOptions":{"org.eclipse.elk.portConstraints":"FREE","org.eclipse.elk.randomSeed":"1"},"x":0.0,"y":0.0,"width":587.0,"height":306.5,"edges":[{"id":"E1","sources":["P1"],"targets":["P6"],"sections":[{"id":"E1_s0","startPoint":{"x":98.0,"y":69.0},"endPoint":{"x":136.5,"y":69.0},"incomingShape":"P1","outgoingShape":"P6"}],"container":"G1"},{"id":"E2","sources":["P4"],"targets":["P11"],"sections":[{"id":"E2_s0","startPoint":{"x":300.0,"y":77.0},"endPoint":{"x":339.0,"y":77.0},"incomingShape":"P4","outgoingShape":"P11"}],"container":"G1"},{"id":"E3","sources":["P4"],"targets":["P9"],"sections":[{"id":"E3_s0","startPoint":{"x":300.0,"y":77.0},"endPoint":{"x":520.0,"y":77.0},"bendPoints":[{"x":329.0,"y":77.0},{"x":329.0,"y":23.0},{"x":510.0,"y":23.0},{"x":510.0,"y":77.0}],"incomingShape":"P4","outgoingShape":"P9"}],"junctionPoints":[{"x":329.0,"y":77.0},{"x":510.0,"y":77.0}],"container":"G1"},{"id":"E4","sources":["P5"],"targets":["P2"],"sections":[{"id":"E4_s0","startPoint":{"x":185.5,"y":69.0},"endPoint":{"x":224.0,"y":69.0},"incomingShape":"P5","outgoingShape":"P2"}],"container":"G1"},{"id":"E5","sources":["P7"],"targets":["P15"],"sections":[{"id":"E5_s0","startPoint":{"x":98.0,"y":274.5},"endPoint":{"x":118.0,"y":274.5},"incomingShape":"P7","outgoingShape":"P15"}],"container":"G1"},{"id":"E6","sources":["P7"],"targets":["P16"],"sections":[{"id":"E6_s0","startPoint":{"x":98.0,"y":274.5},"endPoint":{"x":224.0,"y":160.0},"bendPoints":[{"x":108.0,"y":274.5},{"x":108.0,"y":160.0}],"incomingShape":"P7","outgoingShape":"P16"}],"junctionPoints":[{"x":108.0,"y":274.5}],"container":"G1"},{"id":"E7","sources":["P7"],"targets":["P20"],"sections":[{"id":"E7_s0","startPoint":{"x":98.0,"y":274.5},"endPoint":{"x":118.0,"y":206.5},"bendPoints":[{"x":108.0,"y":274.5},{"x":108.0,"y":206.5}],"incomingShape":"P7","outgoingShape":"P20"}],"junctionPoints":[{"x":108.0,"y":206.5}],"container":"G1"},{"id":"E8","sources":["P10"],"targets":["P8"],"sections":[{"id":"E8_s0","startPoint":{"x":557.0,"y":77.0},"endPoint":{"x":22.0,"y":274.5},"bendPoints":[{"x":575.0,"y":77.0},{"x":575.0,"y":12.0},{"x":12.0,"y":12.0},{"x":12.0,"y":274.5}],"incomingShape":"P10","outgoingShape":"P8"}],"container":"G1"},{"id":"E9","sources":["P12"],"targets":["P23"],"sections":[{"id":"E9_s0","startPoint":{"x":376.0,"y":77.0},"endPoint":{"x":416.0,"y":77.0},"incomingShape":"P12","outgoingShape":"P23"}],"container":"G1"},{"id":"E10","sources":["P14"],"targets":["P17"],"sections":[{"id":"E10_s0","startPoint":{"x":204.0,"y":274.5},"endPoint":{"x":251.5,"y":191.0},"bendPoints":[{"x":251.5,"y":274.5}],"incomingShape":"P14","outgoingShape":"P17"}],"container":"G1"},{"id":"E11","sources":["P18"],"targets":["P13"],"sections":[{"id":"E11_s0","startPoint":{"x":279.0,"y":151.0},"endPoint":{"x":357.5,"y":105.5},"bendPoints":[{"x":357.5,"y":151.0}],"incomingShape":"P18","outgoingShape":"P13"}],"container":"G1"},{"id":"E12","sources":["P19"],"targets":["P21"],"sections":[{"id":"E12_s0","startPoint":{"x":279.0,"y":169.0},"endPoint":{"x":417.0,"y":169.0},"incomingShape":"P19","outgoingShape":"P21"}],"container":"G1"},{"id":"E13","sources":["P22"],"targets":["P9"],"sections":[{"id":"E13_s0","startPoint":{"x":499.0,"y":169.0},"endPoint":{"x":520.0,"y":77.0},"bendPoints":[{"x":510.0,"y":169.0},{"x":510.0,"y":77.0}],"incomingShape":"P22","outgoingShape":"P9"}],"container":"G1"},{"id":"E14","sources":["P24"],"targets":["P3"],"sections":[{"id":"E14_s0","startPoint":{"x":498.0,"y":77.0},"endPoint":{"x":224.0,"y":85.0},"bendPoints":[{"x":510.0,"y":77.0},{"x":510.0,"y":23.0},{"x":329.0,"y":23.0},{"x":329.0,"y":107.0},{"x":214.0,"y":107.0},{"x":214.0,"y":85.0}],"incomingShape":"P24","outgoingShape":"P3"}],"container":"G1"},{"id":"E15","sources":["P24"],"targets":["P9"],"sections":[{"id":"E15_s0","startPoint":{"x":498.0,"y":77.0},"endPoint":{"x":520.0,"y":77.0},"incomingShape":"P24","outgoingShape":"P9"}],"container":"G1"}]}

perf/model_parity_full/report.md

## Drift Samples

- `examples/general/spacing/labels.elkt`: diffs=20 [section=18, coordinate=2], first: children[0]/x: number mismatch (52.0 != 72.0)
- `examples/general/spacing/nodesEdges.elkt`: diffs=20 [section=14, coordinate=6], first: children[0]/y: number mismatch (37.0 != 33.0)
- `examples/general/spacing/ports.elkt`: diffs=1 [coordinate=1], first: children[2]/children[1]/height: number mismatch (60.0 != 40.0)
- `examples/hierarchy/hierarchicalEdges.elkt`: diffs=5 [coordinate=3, section=1, other=1], first: children[0]/children[0]/x: number mismatch (17.0 != 12.0)
- `examples/hierarchy/hierarchicalLayoutMixing.elkt`: diffs=20 [coordinate=10, section=8, structure=2], first: children[0]/children[0]/x: number mismatch (17.0 != 12.0)
- `examples/user-hints/interactive-constraints/interactiveLayeredLayout_circle.elkt`: diffs=6 [structure=3, section=2, coordinate=1], first: children[1]/y: number mismatch (23.0 != 12.0)
- `examples/user-hints/interactive-constraints/interactiveLayeredLayout_circle_pseudo_positions.elkt`: diffs=6 [structure=3, section=2, coordinate=1], first: children[0]/y: number mismatch (12.0 != 23.0)
- `examples/user-hints/interactive-constraints/interactiveLayeredLayout_hierarchyDirection.elkt`: diffs=20 [section=11, coordinate=6, structure=3], first: children[0]/y: number mismatch (67.0 != 12.0)
- `examples/user-hints/interactive-constraints/interactiveLayeredLayout_hierarchyDirection_pseudo_positions.elkt`: diffs=20 [section=11, coordinate=6, structure=3], first: children[0]/y: number mismatch (57.0 != 12.0)
- `examples/user-hints/interactive-constraints/interactiveLayeredLayout_motor_pseudo_positions.elkt`: diffs=20 [coordinate=10, section=8, structure=2], first: children[0]/x: number mismatch (82.0 != 72.0)
- `examples/user-hints/interactive-constraints/interactiveLayeredLayout_sortingTask.elkt`: diffs=6 [coordinate=2, structure=2, section=2], first: children[5]/y: number mismatch (32.0 != 12.0)
- `examples/user-hints/layered/horizontalOrder.elkt`: diffs=12 [coordinate=4, structure=4, section=4], first: children[1]/children[0]/y: number mismatch (43.0 != 32.0)
- `examples/user-hints/layered/partitioning.elkt`: diffs=20 [coordinate=11, section=8, structure=1], first: children[0]/children[0]/x: number mismatch (24.0 != 201.0)
- `examples/user-hints/layered/reverseEdge.elkt`: diffs=12 [structure=6, section=4, coordinate=2], first: children[0]/children[2]/y: number mismatch (12.0 != 23.0)
- `examples/user-hints/layered/verticalOrder.elkt`: diffs=9 [coordinate=4, structure=2, section=2, label=1], first: children[1]/children[1]/y: number mismatch (52.0 != 32.0)
- `examples/user-hints/model-order/modelOrderCrossingMinimization.elkt`: diffs=20 [section=12, label=4, coordinate=3, ordering=1], first: children[0]/edges[1]/labels[0]/y: number mismatch (85.0 != 30.0)
- `examples/user-hints/model-order/modelOrderCycleBreaking.elkt`: diffs=20 [section=12, coordinate=7, structure=1], first: children[0]/children[0]/x: number mismatch (62.0 != 82.0)
- `realworld/ptolemy/flattened/algebraic_heateropentank_HeaterOpenTank.elkg`: diffs=20 [coordinate=14, section=4, structure=1, ordering=1], first: children[5]/x: number mismatch (251.0 != 513.0)
- `realworld/ptolemy/flattened/algebraic_heateropentank_HeaterOpenTank.elkt`: diffs=20 [coordinate=14, section=4, structure=1, ordering=1], first: children[5]/x: number mismatch (251.0 != 513.0)
- `realworld/ptolemy/flattened/algebraic_heateropentank_HeaterOpenTankRefactored.elkg`: diffs=20 [coordinate=16, section=2, ordering=2], first: children[0]/y: number mismatch (96.5 != 358.5)