perf/model_parity_full/java/layout/tests/layered/edge_label_placement/layerSelection_median.elkt.json

{"id":"n0","children":[{"id":"source","x":12.0,"y":127.0,"width":0.0,"height":0.0},{"id":"n1","x":112.0,"y":107.0,"width":50.0,"height":40.0},{"id":"n2","x":182.0,"y":100.33333333333333,"width":60.0,"height":40.0},{"id":"n3","x":262.0,"y":93.66666666666666,"width":70.0,"height":40.0},{"id":"n4","x":352.0,"y":87.0,"width":80.0,"height":40.0},{"id":"n5","x":452.0,"y":80.33333333333333,"width":90.0,"height":40.0},{"id":"n6","x":562.0,"y":73.66666666666666,"width":100.0,"height":40.0},{"id":"n7","x":682.0,"y":66.99999999999999,"width":110.0,"height":40.0},{"id":"target","x":812.0,"y":86.99999999999999,"width":0.0,"height":0.0}],"layoutOptions":{"org.eclipse.elk.layered.edgeLabels.centerLabelPlacementStrategy":"MEDIAN_LAYER","org.eclipse.elk.randomSeed":"1","org.eclipse.elk.algorithm":"layered"},"x":0.0,"y":0.0,"width":824.0,"height":159.0,"edges":[{"id":"e0","sources":["n1"],"targets":["n2"],"sections":[{"id":"e0_s0","startPoint":{"x":162.0,"y":127.0},"endPoint":{"x":182.0,"y":127.0},"incomingShape":"n1","outgoingShape":"n2"}],"container":"n0"},{"id":"e1","sources":["n2"],"targets":["n3"],"sections":[{"id":"e1_s0","startPoint":{"x":242.0,"y":120.33333333333333},"endPoint":{"x":262.0,"y":120.33333333333333},"incomingShape":"n2","outgoingShape":"n3"}],"container":"n0"},{"id":"e2","sources":["n3"],"targets":["n4"],"sections":[{"id":"e2_s0","startPoint":{"x":332.0,"y":113.66666666666666},"endPoint":{"x":352.0,"y":113.66666666666667},"incomingShape":"n3","outgoingShape":"n4"}],"container":"n0"},{"id":"e3","sources":["n4"],"targets":["n5"],"sections":[{"id":"e3_s0","startPoint":{"x":432.0,"y":107.0},"endPoint":{"x":452.0,"y":107.0},"incomingShape":"n4","outgoingShape":"n5"}],"container":"n0"},{"id":"e4","sources":["n5"],"targets":["n6"],"sections":[{"id":"e4_s0","startPoint":{"x":542.0,"y":100.33333333333333},"endPoint":{"x":562.0,"y":100.33333333333333},"incomingShape":"n5","outgoingShape":"n6"}],"container":"n0"},{"id":"e5","sources":["n6"],"targets":["n7"],"sections":[{"id":"e5_s0","startPoint":{"x":662.0,"y":93.66666666666666},"endPoint":{"x":682.0,"y":93.66666666666666},"incomingShape":"n6","outgoingShape":"n7"}],"container":"n0"},{"id":"e6","sources":["n7"],"targets":["target"],"sections":[{"id":"e6_s0","startPoint":{"x":792.0,"y":86.99999999999999},"endPoint":{"x":812.0,"y":86.99999999999999},"incomingShape":"n7","outgoingShape":"target"}],"container":"n0"},{"id":"e7","sources":["source"],"targets":["n1"],"labels":[{"text":"A label","x":92.0,"y":130.0,"width":0.0,"height":0.0}],"sections":[{"id":"e7_s0","startPoint":{"x":12.0,"y":127.0},"endPoint":{"x":112.0,"y":127.0},"incomingShape":"source","outgoingShape":"n1"}],"container":"n0"},{"id":"e8","sources":["source"],"targets":["n2"],"labels":[{"text":"A label","x":92.0,"y":99.0,"width":0.0,"height":0.0}],"sections":[{"id":"e8_s0","startPoint":{"x":12.0,"y":127.0},"endPoint":{"x":182.0,"y":113.66666666666666},"bendPoints":[{"x":82.0,"y":127.0},{"x":82.0,"y":96.0},{"x":172.0,"y":96.0},{"x":172.0,"y":113.66666666666666}],"incomingShape":"source","outgoingShape":"n2"}],"container":"n0"},{"id":"e9","sources":["source"],"targets":["n3"],"labels":[{"text":"A label","x":137.0,"y":85.0,"width":0.0,"height":0.0}],"sections":[{"id":"e9_s0","startPoint":{"x":12.0,"y":127.0},"endPoint":{"x":262.0,"y":106.99999999999999},"bendPoints":[{"x":72.0,"y":127.0},{"x":72.0,"y":82.0},{"x":252.0,"y":82.0},{"x":252.0,"y":107.0}],"incomingShape":"source","outgoingShape":"n3"}],"container":"n0"},{"id":"e10","sources":["source"],"targets":["n4"],"labels":[{"text":"A label","x":137.0,"y":71.0,"width":0.0,"height":0.0}],"sections":[{"id":"e10_s0","startPoint":{"x":12.0,"y":127.0},"endPoint":{"x":352.0,"y":100.33333333333333},"bendPoints":[{"x":62.0,"y":127.0},{"x":62.0,"y":68.0},{"x":342.0,"y":68.0},{"x":342.0,"y":100.33333333333334}],"incomingShape":"source","outgoingShape":"n4"}],"container":"n0"},{"id":"e11","sources":["source"],"targets":["n5"],"labels":[{"text":"A label","x":212.0,"y":57.0,"width":0.0,"height":0.0}],"sections":[{"id":"e11_s0","startPoint":{"x":12.0,"y":127.0},"endPoint":{"x":452.0,"y":93.66666666666666},"bendPoints":[{"x":52.0,"y":127.0},{"x":52.0,"y":54.0},{"x":442.0,"y":54.0},{"x":442.0,"y":93.66666666666666}],"incomingShape":"source","outgoingShape":"n5"}],"container":"n0"},{"id":"e12","sources":["source"],"targets":["n6"],"labels":[{"text":"A label","x":212.0,"y":43.0,"width":0.0,"height":0.0}],"sections":[{"id":"e12_s0","startPoint":{"x":12.0,"y":127.0},"endPoint":{"x":562.0,"y":86.99999999999999},"bendPoints":[{"x":42.0,"y":127.0},{"x":42.0,"y":40.0},{"x":552.0,"y":40.0},{"x":552.0,"y":87.0}],"incomingShape":"source","outgoingShape":"n6"}],"container":"n0"},{"id":"e13","sources":["source"],"targets":["n7"],"labels":[{"text":"A label","x":297.0,"y":29.0,"width":0.0,"height":0.0}],"sections":[{"id":"e13_s0","startPoint":{"x":12.0,"y":127.0},"endPoint":{"x":682.0,"y":80.33333333333331},"bendPoints":[{"x":32.0,"y":127.0},{"x":32.0,"y":26.0},{"x":672.0,"y":26.0},{"x":672.0,"y":80.33333333333331}],"incomingShape":"source","outgoingShape":"n7"}],"container":"n0"},{"id":"e14","sources":["source"],"targets":["target"],"labels":[{"text":"A label","x":297.0,"y":15.0,"width":0.0,"height":0.0}],"sections":[{"id":"e14_s0","startPoint":{"x":12.0,"y":127.0},"endPoint":{"x":812.0,"y":86.99999999999999},"bendPoints":[{"x":22.0,"y":127.0},{"x":22.0,"y":12.0},{"x":802.0,"y":12.0},{"x":802.0,"y":86.99999999999999}],"incomingShape":"source","outgoingShape":"target"}],"container":"n0"}]}

perf/model_parity_full/report.md

## Drift Samples

- `examples/general/spacing/labels.elkt`: diffs=20 [section=18, coordinate=2], first: children[0]/x: number mismatch (52.0 != 72.0)
- `examples/general/spacing/nodesEdges.elkt`: diffs=20 [section=14, coordinate=6], first: children[0]/y: number mismatch (37.0 != 33.0)
- `examples/general/spacing/ports.elkt`: diffs=1 [coordinate=1], first: children[2]/children[1]/height: number mismatch (60.0 != 40.0)
- `examples/hierarchy/hierarchicalEdges.elkt`: diffs=5 [coordinate=3, section=1, other=1], first: children[0]/children[0]/x: number mismatch (17.0 != 12.0)
- `examples/hierarchy/hierarchicalLayoutMixing.elkt`: diffs=20 [coordinate=10, section=8, structure=2], first: children[0]/children[0]/x: number mismatch (17.0 != 12.0)
- `examples/user-hints/interactive-constraints/interactiveLayeredLayout_circle.elkt`: diffs=6 [structure=3, section=2, coordinate=1], first: children[1]/y: number mismatch (23.0 != 12.0)
- `examples/user-hints/interactive-constraints/interactiveLayeredLayout_circle_pseudo_positions.elkt`: diffs=6 [structure=3, section=2, coordinate=1], first: children[0]/y: number mismatch (12.0 != 23.0)
- `examples/user-hints/interactive-constraints/interactiveLayeredLayout_hierarchyDirection.elkt`: diffs=20 [section=11, coordinate=6, structure=3], first: children[0]/y: number mismatch (67.0 != 12.0)
- `examples/user-hints/interactive-constraints/interactiveLayeredLayout_hierarchyDirection_pseudo_positions.elkt`: diffs=20 [section=11, coordinate=6, structure=3], first: children[0]/y: number mismatch (57.0 != 12.0)
- `examples/user-hints/interactive-constraints/interactiveLayeredLayout_motor_pseudo_positions.elkt`: diffs=20 [coordinate=10, section=8, structure=2], first: children[0]/x: number mismatch (82.0 != 72.0)
- `examples/user-hints/interactive-constraints/interactiveLayeredLayout_sortingTask.elkt`: diffs=6 [coordinate=2, structure=2, section=2], first: children[5]/y: number mismatch (32.0 != 12.0)
- `examples/user-hints/layered/horizontalOrder.elkt`: diffs=12 [coordinate=4, structure=4, section=4], first: children[1]/children[0]/y: number mismatch (43.0 != 32.0)
- `examples/user-hints/layered/partitioning.elkt`: diffs=20 [coordinate=11, section=8, structure=1], first: children[0]/children[0]/x: number mismatch (24.0 != 201.0)
- `examples/user-hints/layered/reverseEdge.elkt`: diffs=12 [structure=6, section=4, coordinate=2], first: children[0]/children[2]/y: number mismatch (12.0 != 23.0)
- `examples/user-hints/layered/verticalOrder.elkt`: diffs=9 [coordinate=4, structure=2, section=2, label=1], first: children[1]/children[1]/y: number mismatch (52.0 != 32.0)
- `examples/user-hints/model-order/modelOrderCrossingMinimization.elkt`: diffs=20 [section=12, label=4, coordinate=3, ordering=1], first: children[0]/edges[1]/labels[0]/y: number mismatch (85.0 != 30.0)
- `examples/user-hints/model-order/modelOrderCycleBreaking.elkt`: diffs=20 [section=12, coordinate=7, structure=1], first: children[0]/children[0]/x: number mismatch (62.0 != 82.0)
- `realworld/ptolemy/flattened/algebraic_heateropentank_HeaterOpenTank.elkg`: diffs=20 [coordinate=14, section=4, structure=1, ordering=1], first: children[5]/x: number mismatch (251.0 != 513.0)
- `realworld/ptolemy/flattened/algebraic_heateropentank_HeaterOpenTank.elkt`: diffs=20 [coordinate=14, section=4, structure=1, ordering=1], first: children[5]/x: number mismatch (251.0 != 513.0)
- `realworld/ptolemy/flattened/algebraic_heateropentank_HeaterOpenTankRefactored.elkg`: diffs=20 [coordinate=16, section=2, ordering=2], first: children[0]/y: number mismatch (96.5 != 358.5)