perf/model_parity/rust/layout/realworld/ptolemy/flattened/algebraic_heateropentank_HeaterOpenTank.elkt.json

{"children":[{"height":40.0,"id":"N1","labels":[{"height":15.0,"id":"L1","text":"QSSIntegrator","width":83.0,"x":0.0,"y":-20.0}],"layoutOptions":{"org.eclipse.elk.nodeLabels.placement":"[H_LEFT, V_TOP, OUTSIDE]","org.eclipse.elk.portConstraints":"FIXED_ORDER"},"ports":[{"height":8.0,"id":"P1","layoutOptions":{"org.eclipse.elk.port.index":"0","org.eclipse.elk.port.side":"WEST"},"width":8.0,"x":-8.0,"y":16.0},{"height":8.0,"id":"P2","layoutOptions":{"org.eclipse.elk.port.index":"1","org.eclipse.elk.port.side":"EAST"},"width":8.0,"x":60.0,"y":16.0}],"width":60.0,"x":172.0,"y":42.0},{"height":41.0,"id":"N2","labels":[{"height":15.0,"id":"L2","text":"TimedPlotter","width":74.0,"x":0.0,"y":-20.0}],"layoutOptions":{"org.eclipse.elk.nodeLabels.placement":"[H_LEFT, V_TOP, OUTSIDE]","org.eclipse.elk.portConstraints":"FIXED_ORDER"},"ports":[{"height":8.0,"id":"P3","layoutOptions":{"org.eclipse.elk.port.index":"0","org.eclipse.elk.port.side":"WEST"},"width":8.0,"x":-8.0,"y":16.5}],"width":41.0,"x":454.0,"y":77.5},{"height":31.0,"id":"N3","labels":[{"height":15.0,"id":"L3","text":"Display","width":43.0,"x":0.0,"y":-20.0}],"layoutOptions":{"org.eclipse.elk.nodeLabels.placement":"[H_LEFT, V_TOP, OUTSIDE]","org.eclipse.elk.portConstraints":"FIXED_ORDER"},"ports":[{"height":8.0,"id":"P4","layoutOptions":{"org.eclipse.elk.port.index":"0","org.eclipse.elk.port.side":"WEST"},"width":8.0,"x":-8.0,"y":11.5}],"width":41.0,"x":513.0,"y":220.0},{"height":41.0,"id":"N4","labels":[{"height":15.0,"id":"L4","text":"dp","width":15.0,"x":0.0,"y":-20.0}],"layoutOptions":{"org.eclipse.elk.nodeLabels.placement":"[H_LEFT, V_TOP, OUTSIDE]","org.eclipse.elk.portConstraints":"FIXED_ORDER"},"ports":[{"height":8.0,"id":"P5","layoutOptions":{"org.eclipse.elk.port.index":"0","org.eclipse.elk.port.side":"WEST"},"width":8.0,"x":-8.0,"y":8.333333015441895},{"height":8.0,"id":"P6","layoutOptions":{"org.eclipse.elk.port.index":"-1","org.eclipse.elk.port.side":"WEST"},"width":8.0,"x":-8.0,"y":24.66666603088379},{"height":8.0,"id":"P7","layoutOptions":{"org.eclipse.elk.port.index":"2","org.eclipse.elk.port.side":"EAST"},"width":8.0,"x":41.0,"y":16.5}],"width":41.0,"x":215.0,"y":215.0},{"height":25.0,"id":"N5","labels":[{"height":15.0,"id":"L5","text":"Const2","width":42.0,"x":0.0,"y":-20.0}],"layoutOptions":{"org.eclipse.elk.nodeLabels.placement":"[H_LEFT, V_TOP, OUTSIDE]","org.eclipse.elk.portConstraints":"FIXED_ORDER"},"ports":[{"height":8.0,"id":"P8","layoutOptions":{"org.eclipse.elk.port.index":"0","org.eclipse.elk.port.side":"EAST"},"width":8.0,"x":41.0,"y":8.5},{"height":8.0,"id":"P9","layoutOptions":{"org.eclipse.elk.port.index":"-1","org.eclipse.elk.port.side":"WEST"},"width":8.0,"x":-8.0,"y":8.5}],"width":41.0,"x":138.0,"y":296.5},{"height":25.0,"id":"N6","labels":[{"height":15.0,"id":"L6","text":"Expression","width":66.0,"x":0.0,"y":-20.0}],"layoutOptions":{"org.eclipse.elk.nodeLabels.placement":"[H_LEFT, V_TOP, OUTSIDE]","org.eclipse.elk.portConstraints":"FIXED_ORDER"},"ports":[{"height":8.0,"id":"P10","layoutOptions":{"org.eclipse.elk.port.index":"0","org.eclipse.elk.port.side":"EAST"},"width":8.0,"x":106.0,"y":8.5},{"height":8.0,"id":"P11","layoutOptions":{"org.eclipse.elk.port.index":"-1","org.eclipse.elk.port.side":"WEST"},"width":8.0,"x":-8.0,"y":0.25},{"height":8.0,"id":"P12","layoutOptions":{"org.eclipse.elk.port.index":"-2","org.eclipse.elk.port.side":"WEST"},"width":8.0,"x":-8.0,"y":8.5},{"height":8.0,"id":"P13","layoutOptions":{"org.eclipse.elk.port.index":"-3","org.eclipse.elk.port.side":"WEST"},"width":8.0,"x":-8.0,"y":16.75}],"width":106.0,"x":30.0,"y":49.5},{"height":25.0,"id":"N7","labels":[{"height":15.0,"id":"L7","text":"Expression2","width":73.0,"x":0.0,"y":-20.0}],"layoutOptions":{"org.eclipse.elk.nodeLabels.placement":"[H_LEFT, V_TOP, OUTSIDE]","org.eclipse.elk.portConstraints":"FIXED_ORDER"},"ports":[{"height":8.0,"id":"P14","layoutOptions":{"org.eclipse.elk.port.index":"0","org.eclipse.elk.port.side":"EAST"},"width":8.0,"x":185.0,"y":8.5},{"height":8.0,"id":"P15","layoutOptions":{"org.eclipse.elk.port.index":"-1","org.eclipse.elk.port.side":"WEST"},"width":8.0,"x":-8.0,"y":8.5}],"width":185.0,"x":292.0,"y":223.0},{"height":25.0,"id":"N8","labels":[{"height":15.0,"id":"L8","text":"Expression","width":66.0,"x":0.0,"y":-20.0}],"layoutOptions":{"org.eclipse.elk.nodeLabels.placement":"[H_LEFT, V_TOP, OUTSIDE]","org.eclipse.elk.portConstraints":"FIXED_ORDER"},"ports":[{"height":8.0,"id":"P16","layoutOptions":{"org.eclipse.elk.port.index":"0","org.eclipse.elk.port.side":"EAST"},"width":8.0,"x":146.0,"y":8.5},{"height":8.0,"id":"P17","layoutOptions":{"org.eclipse.elk.port.index":"-1","org.eclipse.elk.port.side":"WEST"},"width":8.0,"x":-8.0,"y":3.0},{"height":8.0,"id":"P18","layoutOptions":{"org.eclipse.elk.port.index":"-2","org.eclipse.elk.port.side":"WEST"},"width":8.0,"x":-8.0,"y":14.0}],"width":146.0,"x":513.0,"y":291.0},{"height":25.0,"id":"N9","labels":[{"height":15.0,"id":"L9","text":"Expression","width":66.0,"x":0.0,"y":-20.0}],"layoutOptions":{"org.eclipse.elk.nodeLabels.placement":"[H_LEFT, V_TOP, OUTSIDE]","org.eclipse.elk.portConstraints":"FIXED_ORDER"},"ports":[{"height":8.0,"id":"P19","layoutOptions":{"org.eclipse.elk.port.index":"0","org.eclipse.elk.port.side":"EAST"},"width":8.0,"x":149.0,"y":8.5},{"height":8.0,"id":"P20","layoutOptions":{"org.eclipse.elk.port.index":"-1","org.eclipse.elk.port.side":"WEST"},"width":8.0,"x":-8.0,"y":3.0},{"height":8.0,"id":"P21","layoutOptions":{"org.eclipse.elk.port.index":"-2","org.eclipse.elk.port.side":"WEST"},"width":8.0,"x":-8.0,"y":14.0}],"width":149.0,"x":30.0,"y":214.8333330154419},{"height":46.0,"id":"N10","labels":[{"height":15.0,"id":"L10","text":"SingleEvent","width":68.0,"x":0.0,"y":-20.0}],"layoutOptions":{"org.eclipse.elk.nodeLabels.placement":"[H_LEFT, V_TOP, OUTSIDE]","org.eclipse.elk.portConstraints":"FIXED_ORDER"},"ports":[{"height":8.0,"id":"P22","layoutOptions":{"org.eclipse.elk.port.index":"0","org.eclipse.elk.port.side":"EAST"},"width":8.0,"x":66.0,"y":19.0}],"width":66.0,"x":285.0,"y":118.0},{"height":41.0,"id":"N11","labels":[{"height":15.0,"id":"L11","text":"Merge","width":37.0,"x":0.0,"y":-20.0}],"layoutOptions":{"org.eclipse.elk.nodeLabels.placement":"[H_LEFT, V_TOP, OUTSIDE]","org.eclipse.elk.portConstraints":"FIXED_ORDER"},"ports":[{"height":8.0,"id":"P23","layoutOptions":{"org.eclipse.elk.port.index":"0","org.eclipse.elk.port.side":"WEST"},"width":8.0,"x":-8.0,"y":16.5},{"height":8.0,"id":"P24","layoutOptions":{"org.eclipse.elk.port.index":"1","org.eclipse.elk.port.side":"EAST"},"width":8.0,"x":21.0,"y":16.5}],"width":21.0,"x":389.0,"y":77.5},{"height":46.0,"id":"N12","labels":[{"height":15.0,"id":"L12","text":"SingleEvent3","width":76.0,"x":0.0,"y":-20.0}],"layoutOptions":{"org.eclipse.elk.nodeLabels.placement":"[H_LEFT, V_TOP, OUTSIDE]","org.eclipse.elk.portConstraints":"FIXED_ORDER"},"ports":[{"height":8.0,"id":"P25","layoutOptions":{"org.eclipse.elk.port.index":"0","org.eclipse.elk.port.side":"EAST"},"width":8.0,"x":66.0,"y":19.0}],"width":66.0,"x":285.0,"y":32.0}],"edges":[{"container":"G1","id":"E1","sections":[{"bendPoints":[{"x":265.0,"y":62.0},{"x":265.0,"y":12.0},{"x":12.0,"y":12.0},{"x":12.0,"y":70.25}],"endPoint":{"x":22.0,"y":70.25},"id":"E1_s0","incomingShape":"P2","outgoingShape":"P13","startPoint":{"x":240.0,"y":62.0}}],"sources":["P2"],"targets":["P13"]},{"container":"G1","id":"E2","sections":[{"endPoint":{"x":284.0,"y":235.5},"id":"E2_s0","incomingShape":"P7","outgoingShape":"P15","startPoint":{"x":264.0,"y":235.5}}],"sources":["P7"],"targets":["P15"]},{"container":"G1","id":"E3","sections":[{"bendPoints":[{"x":197.0,"y":309.0},{"x":197.0,"y":243.6666660308838}],"endPoint":{"x":207.0,"y":243.6666660308838},"id":"E3_s0","incomingShape":"P8","outgoingShape":"P6","startPoint":{"x":187.0,"y":309.0}}],"sources":["P8"],"targets":["P6"]},{"container":"G1","id":"E4","sections":[{"endPoint":{"x":505.0,"y":309.0},"id":"E4_s0","incomingShape":"P8","outgoingShape":"P18","startPoint":{"x":187.0,"y":309.0}}],"sources":["P8"],"targets":["P18"]},{"container":"G1","id":"E5","sections":[{"endPoint":{"x":164.0,"y":62.0},"id":"E5_s0","incomingShape":"P10","outgoingShape":"P1","startPoint":{"x":144.0,"y":62.0}}],"sources":["P10"],"targets":["P1"]},{"container":"G1","id":"E6","sections":[{"bendPoints":[{"x":495.0,"y":235.5},{"x":495.0,"y":298.0}],"endPoint":{"x":505.0,"y":298.0},"id":"E6_s0","incomingShape":"P14","outgoingShape":"P17","startPoint":{"x":485.0,"y":235.5}}],"sources":["P14"],"targets":["P17"]},{"container":"G1","id":"E7","sections":[{"endPoint":{"x":505.0,"y":235.5},"id":"E7_s0","incomingShape":"P14","outgoingShape":"P4","startPoint":{"x":485.0,"y":235.5}}],"sources":["P14"],"targets":["P4"]},{"container":"G1","id":"E8","sections":[{"bendPoints":[{"x":677.0,"y":303.5},{"x":677.0,"y":184.0},{"x":12.0,"y":184.0},{"x":12.0,"y":232.8333330154419}],"endPoint":{"x":22.0,"y":232.8333330154419},"id":"E8_s0","incomingShape":"P16","outgoingShape":"P21","startPoint":{"x":667.0,"y":303.5}}],"sources":["P16"],"targets":["P21"]},{"container":"G1","id":"E9","sections":[{"endPoint":{"x":207.0,"y":227.3333330154419},"id":"E9_s0","incomingShape":"P19","outgoingShape":"P5","startPoint":{"x":187.0,"y":227.3333330154419}}],"sources":["P19"],"targets":["P5"]},{"container":"G1","id":"E10","sections":[{"bendPoints":[{"x":371.0,"y":141.0},{"x":371.0,"y":98.0}],"endPoint":{"x":381.0,"y":98.0},"id":"E10_s0","incomingShape":"P22","outgoingShape":"P23","startPoint":{"x":359.0,"y":141.0}}],"sources":["P22"],"targets":["P23"]},{"container":"G1","id":"E11","sections":[{"endPoint":{"x":446.0,"y":98.0},"id":"E11_s0","incomingShape":"P24","outgoingShape":"P3","startPoint":{"x":418.0,"y":98.0}}],"sources":["P24"],"targets":["P3"]},{"container":"G1","id":"E12","sections":[{"bendPoints":[{"x":371.0,"y":55.0},{"x":371.0,"y":98.0}],"endPoint":{"x":381.0,"y":98.0},"id":"E12_s0","incomingShape":"P25","outgoingShape":"P23","startPoint":{"x":359.0,"y":55.0}}],"sources":["P25"],"targets":["P23"]}],"height":333.5,"id":"G1","layoutOptions":{"org.eclipse.elk.portConstraints":"FREE","org.eclipse.elk.randomSeed":"1"},"width":689.0,"x":0.0,"y":0.0}

perf/model_parity_tests/report.md

## Drift Samples

- `tests/core/label_placement/port_labels/next_to_port_if_possible_inside.elkt`: diffs=5 [coordinate=4, other=1], first: children[0]/ports[0]/x: number mismatch (4.0 != 24.0)
- `tests/core/label_placement/port_labels/treat_as_group_outside.elkt`: diffs=4 [label=2, coordinate=1, other=1], first: children[0]/height: number mismatch (30.0 != 20.0)
- `tests/core/label_placement/port_labels/variants.elkt`: diffs=20 [coordinate=13, section=4, label=3], first: children[0]/children[0]/x: number mismatch (12.0 != 36.0)
- `tests/core/node_size/inside_port_labels.elkt`: diffs=16 [coordinate=14, label=1, other=1], first: children[0]/height: number mismatch (64.0 != 0.0)
- `tests/layered/compaction_oned/hierarchical_ports/hports1.elkt`: diffs=20 [section=12, coordinate=4, label=4], first: children[0]/children[0]/x: number mismatch (32.0 != 52.0)
- `tests/layered/compaction_oned/labels/edgeLabelAndSplines.elkt`: diffs=20 [section=8, coordinate=6, label=4, ordering=2], first: children[0]/y: number mismatch (20.5 != 19.0)
- `tests/layered/compaction_oned/labels/edgeLabelShouldBeCentered.elkt`: diffs=12 [section=6, coordinate=3, label=2, ordering=1], first: children[0]/y: number mismatch (32.66666666666667 != 15.333333333333334)
- `tests/layered/compaction_oned/labels/edgeLabelSideSelection01.elkt`: diffs=16 [section=8, coordinate=4, label=3, other=1], first: children[0]/y: number mismatch (15.0 != 12.0)
- `tests/layered/compaction_oned/labels/labels1.elkt`: diffs=20 [coordinate=12, section=4, label=3, ordering=1], first: children[0]/x: number mismatch (305.0 != 340.0)
- `tests/layered/compaction_oned/labels/labels2.elkt`: diffs=20 [coordinate=9, section=6, label=4, ordering=1], first: children[0]/x: number mismatch (554.0 != 1021.0)
- `tests/layered/compaction_oned/nsport/south_port.elkt`: diffs=4 [section=2, coordinate=1, other=1], first: children[2]/x: number mismatch (41.3333 != 61.3333)
- `tests/layered/compaction_oned/selfloop/selfloop_crash.elkt`: diffs=20 [section=12, coordinate=6, ordering=2], first: children[0]/y: number mismatch (73.0 != 72.0)
- `tests/layered/compaction_oned/selfloop/selfloop_orthogonal.elkt`: diffs=16 [section=10, coordinate=4, structure=2], first: children[0]/y: number mismatch (42.0 != 12.0)
- `tests/layered/compaction_oned/selfloop/selfloop_spline.elkt`: diffs=20 [section=11, coordinate=6, ordering=3], first: children[0]/y: number mismatch (43.0 != 12.0)
- `tests/layered/compaction_oned/splines/moreThanOneStraightSegmentPath.elkt`: diffs=20 [coordinate=15, section=5], first: children[0]/y: number mismatch (77.5 != 72.5)
- `tests/layered/compaction_oned/splines/moreThanOneStraightSegmentPath2.elkt`: diffs=20 [section=11, coordinate=9], first: children[1]/x: number mismatch (52.0 != 32.0)
- `tests/layered/connected_components/all_four_port_sides.elkt`: diffs=20 [section=12, coordinate=4, structure=4], first: children[0]/children[1]/x: number mismatch (62.0 != 52.0)
- `tests/layered/connected_components/compound02.elkt`: diffs=20 [section=12, coordinate=8], first: children[0]/children[0]/x: number mismatch (12.0 != 34.5)
- `tests/layered/connected_components/compound03.elkt`: diffs=20 [coordinate=20], first: children[0]/children[0]/y: number mismatch (22.0 != 12.0)
- `tests/layered/connected_components/compound04.elkt`: diffs=20 [section=10, coordinate=6, structure=4], first: children[0]/children[1]/x: number mismatch (122.0 != 82.0)