perf/model_parity_full/java/layout/realworld/ptolemy/flattened/algebraic_heateropentank_HeaterOpenTank.elkg.json

{"id":"G1","children":[{"id":"N1","labels":[{"text":"QSSIntegrator","id":"L1","x":0.0,"y":-20.0,"width":83.0,"height":15.0}],"ports":[{"id":"P1","layoutOptions":{"org.eclipse.elk.port.side":"WEST","org.eclipse.elk.port.index":"0"},"x":-8.0,"y":16.0,"width":8.0,"height":8.0},{"id":"P2","layoutOptions":{"org.eclipse.elk.port.side":"EAST","org.eclipse.elk.port.index":"1"},"x":60.0,"y":16.0,"width":8.0,"height":8.0}],"layoutOptions":{"org.eclipse.elk.portConstraints":"FIXED_ORDER","org.eclipse.elk.nodeLabels.placement":"[H_LEFT, V_TOP, OUTSIDE]"},"x":172.0,"y":32.0,"width":60.0,"height":40.0},{"id":"N2","labels":[{"text":"TimedPlotter","id":"L2","x":0.0,"y":-20.0,"width":74.0,"height":15.0}],"ports":[{"id":"P3","layoutOptions":{"org.eclipse.elk.port.side":"WEST","org.eclipse.elk.port.index":"0"},"x":-8.0,"y":16.5,"width":8.0,"height":8.0}],"layoutOptions":{"org.eclipse.elk.portConstraints":"FIXED_ORDER","org.eclipse.elk.nodeLabels.placement":"[H_LEFT, V_TOP, OUTSIDE]"},"x":454.0,"y":34.5,"width":41.0,"height":41.0},{"id":"N3","labels":[{"text":"Display","id":"L3","x":0.0,"y":-20.0,"width":43.0,"height":15.0}],"ports":[{"id":"P4","layoutOptions":{"org.eclipse.elk.port.side":"WEST","org.eclipse.elk.port.index":"0"},"x":-8.0,"y":11.5,"width":8.0,"height":8.0}],"layoutOptions":{"org.eclipse.elk.portConstraints":"FIXED_ORDER","org.eclipse.elk.nodeLabels.placement":"[H_LEFT, V_TOP, OUTSIDE]"},"x":251.0,"y":204.0,"width":41.0,"height":31.0},{"id":"N4","labels":[{"text":"dp","id":"L4","x":0.0,"y":-20.0,"width":15.0,"height":15.0}],"ports":[{"id":"P5","layoutOptions":{"org.eclipse.elk.port.side":"WEST","org.eclipse.elk.port.index":"0"},"x":-8.0,"y":8.333333333333334,"width":8.0,"height":8.0},{"id":"P6","layoutOptions":{"org.eclipse.elk.port.side":"WEST","org.eclipse.elk.port.index":"-1"},"x":-8.0,"y":24.66666666666667,"width":8.0,"height":8.0},{"id":"P7","layoutOptions":{"org.eclipse.elk.port.side":"EAST","org.eclipse.elk.port.index":"2"},"x":41.0,"y":16.5,"width":8.0,"height":8.0}],"layoutOptions":{"org.eclipse.elk.portConstraints":"FIXED_ORDER","org.eclipse.elk.nodeLabels.placement":"[H_LEFT, V_TOP, OUTSIDE]"},"x":618.0,"y":269.66666666666663,"width":41.0,"height":41.0},{"id":"N5","labels":[{"text":"Const2","id":"L5","x":0.0,"y":-20.0,"width":42.0,"height":15.0}],"ports":[{"id":"P8","layoutOptions":{"org.eclipse.elk.port.side":"EAST","org.eclipse.elk.port.index":"0"},"x":41.0,"y":8.5,"width":8.0,"height":8.0},{"id":"P9","layoutOptions":{"org.eclipse.elk.port.side":"WEST","org.eclipse.elk.port.index":"-1"},"x":-8.0,"y":8.5,"width":8.0,"height":8.0}],"layoutOptions":{"org.eclipse.elk.portConstraints":"FIXED_ORDER","org.eclipse.elk.nodeLabels.placement":"[H_LEFT, V_TOP, OUTSIDE]"},"x":174.0,"y":280.5,"width":41.0,"height":25.0},{"id":"N6","labels":[{"text":"Expression","id":"L6","x":0.0,"y":-20.0,"width":66.0,"height":15.0}],"ports":[{"id":"P10","layoutOptions":{"org.eclipse.elk.port.side":"EAST","org.eclipse.elk.port.index":"0"},"x":106.0,"y":8.5,"width":8.0,"height":8.0},{"id":"P11","layoutOptions":{"org.eclipse.elk.port.side":"WEST","org.eclipse.elk.port.index":"-1"},"x":-8.0,"y":0.25,"width":8.0,"height":8.0},{"id":"P12","layoutOptions":{"org.eclipse.elk.port.side":"WEST","org.eclipse.elk.port.index":"-2"},"x":-8.0,"y":8.5,"width":8.0,"height":8.0},{"id":"P13","layoutOptions":{"org.eclipse.elk.port.side":"WEST","org.eclipse.elk.port.index":"-3"},"x":-8.0,"y":16.75,"width":8.0,"height":8.0}],"layoutOptions":{"org.eclipse.elk.portConstraints":"FIXED_ORDER","org.eclipse.elk.nodeLabels.placement":"[H_LEFT, V_TOP, OUTSIDE]"},"x":30.0,"y":39.5,"width":106.0,"height":25.0},{"id":"N7","labels":[{"text":"Expression2","id":"L7","x":0.0,"y":-20.0,"width":73.0,"height":15.0}],"ports":[{"id":"P14","layoutOptions":{"org.eclipse.elk.port.side":"EAST","org.eclipse.elk.port.index":"0"},"x":185.0,"y":8.5,"width":8.0,"height":8.0},{"id":"P15","layoutOptions":{"org.eclipse.elk.port.side":"WEST","org.eclipse.elk.port.index":"-1"},"x":-8.0,"y":8.5,"width":8.0,"height":8.0}],"layoutOptions":{"org.eclipse.elk.portConstraints":"FIXED_ORDER","org.eclipse.elk.nodeLabels.placement":"[H_LEFT, V_TOP, OUTSIDE]"},"x":30.0,"y":207.0,"width":185.0,"height":25.0},{"id":"N8","labels":[{"text":"Expression","id":"L8","x":0.0,"y":-20.0,"width":66.0,"height":15.0}],"ports":[{"id":"P16","layoutOptions":{"org.eclipse.elk.port.side":"EAST","org.eclipse.elk.port.index":"0"},"x":146.0,"y":8.5,"width":8.0,"height":8.0},{"id":"P17","layoutOptions":{"org.eclipse.elk.port.side":"WEST","org.eclipse.elk.port.index":"-1"},"x":-8.0,"y":3.0,"width":8.0,"height":8.0},{"id":"P18","layoutOptions":{"org.eclipse.elk.port.side":"WEST","org.eclipse.elk.port.index":"-2"},"x":-8.0,"y":14.0,"width":8.0,"height":8.0}],"layoutOptions":{"org.eclipse.elk.portConstraints":"FIXED_ORDER","org.eclipse.elk.nodeLabels.placement":"[H_LEFT, V_TOP, OUTSIDE]"},"x":251.0,"y":275.0,"width":146.0,"height":25.0},{"id":"N9","labels":[{"text":"Expression","id":"L9","x":0.0,"y":-20.0,"width":66.0,"height":15.0}],"ports":[{"id":"P19","layoutOptions":{"org.eclipse.elk.port.side":"EAST","org.eclipse.elk.port.index":"0"},"x":149.0,"y":8.5,"width":8.0,"height":8.0},{"id":"P20","layoutOptions":{"org.eclipse.elk.port.side":"WEST","org.eclipse.elk.port.index":"-1"},"x":-8.0,"y":3.0,"width":8.0,"height":8.0},{"id":"P21","layoutOptions":{"org.eclipse.elk.port.side":"WEST","org.eclipse.elk.port.index":"-2"},"x":-8.0,"y":14.0,"width":8.0,"height":8.0}],"layoutOptions":{"org.eclipse.elk.portConstraints":"FIXED_ORDER","org.eclipse.elk.nodeLabels.placement":"[H_LEFT, V_TOP, OUTSIDE]"},"x":433.0,"y":269.5,"width":149.0,"height":25.0},{"id":"N10","labels":[{"text":"SingleEvent","id":"L10","x":0.0,"y":-20.0,"width":68.0,"height":15.0}],"ports":[{"id":"P22","layoutOptions":{"org.eclipse.elk.port.side":"EAST","org.eclipse.elk.port.index":"0"},"x":66.0,"y":19.0,"width":8.0,"height":8.0}],"layoutOptions":{"org.eclipse.elk.portConstraints":"FIXED_ORDER","org.eclipse.elk.nodeLabels.placement":"[H_LEFT, V_TOP, OUTSIDE]"},"x":285.0,"y":118.0,"width":66.0,"height":46.0},{"id":"N11","labels":[{"text":"Merge","id":"L11","x":0.0,"y":-20.0,"width":37.0,"height":15.0}],"ports":[{"id":"P23","layoutOptions":{"org.eclipse.elk.port.side":"WEST","org.eclipse.elk.port.index":"0"},"x":-8.0,"y":16.5,"width":8.0,"height":8.0},{"id":"P24","layoutOptions":{"org.eclipse.elk.port.side":"EAST","org.eclipse.elk.port.index":"1"},"x":21.0,"y":16.5,"width":8.0,"height":8.0}],"layoutOptions":{"org.eclipse.elk.portConstraints":"FIXED_ORDER","org.eclipse.elk.nodeLabels.placement":"[H_LEFT, V_TOP, OUTSIDE]"},"x":389.0,"y":34.5,"width":21.0,"height":41.0},{"id":"N12","labels":[{"text":"SingleEvent3","id":"L12","x":0.0,"y":-20.0,"width":76.0,"height":15.0}],"ports":[{"id":"P25","layoutOptions":{"org.eclipse.elk.port.side":"EAST","org.eclipse.elk.port.index":"0"},"x":66.0,"y":19.0,"width":8.0,"height":8.0}],"layoutOptions":{"org.eclipse.elk.portConstraints":"FIXED_ORDER","org.eclipse.elk.nodeLabels.placement":"[H_LEFT, V_TOP, OUTSIDE]"},"x":285.0,"y":32.0,"width":66.0,"height":46.0}],"layoutOptions":{"org.eclipse.elk.portConstraints":"FREE","org.eclipse.elk.randomSeed":"1"},"x":0.0,"y":0.0,"width":689.0,"height":334.0,"edges":[{"id":"E1","sources":["P2"],"targets":["P13"],"sections":[{"id":"E1_s0","startPoint":{"x":240.0,"y":52.0},"endPoint":{"x":22.0,"y":60.25},"bendPoints":[{"x":265.0,"y":52.0},{"x":265.0,"y":82.0},{"x":12.0,"y":82.0},{"x":12.0,"y":60.25}],"incomingShape":"P2","outgoingShape":"P13"}],"container":"G1"},{"id":"E2","sources":["P7"],"targets":["P15"],"sections":[{"id":"E2_s0","startPoint":{"x":667.0,"y":290.16666666666663},"endPoint":{"x":22.0,"y":219.5},"bendPoints":[{"x":677.0,"y":290.16666666666663},{"x":677.0,"y":321.0},{"x":12.0,"y":321.0},{"x":12.0,"y":219.5}],"incomingShape":"P7","outgoingShape":"P15"}],"container":"G1"},{"id":"E3","sources":["P8"],"targets":["P6"],"sections":[{"id":"E3_s0","startPoint":{"x":223.0,"y":293.0},"endPoint":{"x":610.0,"y":298.3333333333333},"bendPoints":[{"x":233.0,"y":293.0},{"x":233.0,"y":310.0},{"x":600.0,"y":310.0},{"x":600.0,"y":298.3333333333333}],"incomingShape":"P8","outgoingShape":"P6"}],"junctionPoints":[{"x":233.0,"y":293.0}],"container":"G1"},{"id":"E4","sources":["P8"],"targets":["P18"],"sections":[{"id":"E4_s0","startPoint":{"x":223.0,"y":293.0},"endPoint":{"x":243.0,"y":293.0},"incomingShape":"P8","outgoingShape":"P18"}],"container":"G1"},{"id":"E5","sources":["P10"],"targets":["P1"],"sections":[{"id":"E5_s0","startPoint":{"x":144.0,"y":52.0},"endPoint":{"x":164.0,"y":52.0},"incomingShape":"P10","outgoingShape":"P1"}],"container":"G1"},{"id":"E6","sources":["P14"],"targets":["P17"],"sections":[{"id":"E6_s0","startPoint":{"x":223.0,"y":219.5},"endPoint":{"x":243.0,"y":282.0},"bendPoints":[{"x":233.0,"y":219.5},{"x":233.0,"y":282.0}],"incomingShape":"P14","outgoingShape":"P17"}],"junctionPoints":[{"x":233.0,"y":219.5}],"container":"G1"},{"id":"E7","sources":["P14"],"targets":["P4"],"sections":[{"id":"E7_s0","startPoint":{"x":223.0,"y":219.5},"endPoint":{"x":243.0,"y":219.5},"incomingShape":"P14","outgoingShape":"P4"}],"container":"G1"},{"id":"E8","sources":["P16"],"targets":["P21"],"sections":[{"id":"E8_s0","startPoint":{"x":405.0,"y":287.5},"endPoint":{"x":425.0,"y":287.5},"incomingShape":"P16","outgoingShape":"P21"}],"container":"G1"},{"id":"E9","sources":["P19"],"targets":["P5"],"sections":[{"id":"E9_s0","startPoint":{"x":590.0,"y":282.0},"endPoint":{"x":610.0,"y":281.99999999999994},"incomingShape":"P19","outgoingShape":"P5"}],"container":"G1"},{"id":"E10","sources":["P22"],"targets":["P23"],"sections":[{"id":"E10_s0","startPoint":{"x":359.0,"y":141.0},"endPoint":{"x":381.0,"y":55.0},"bendPoints":[{"x":371.0,"y":141.0},{"x":371.0,"y":55.0}],"incomingShape":"P22","outgoingShape":"P23"}],"junctionPoints":[{"x":371.0,"y":55.0}],"container":"G1"},{"id":"E11","sources":["P24"],"targets":["P3"],"sections":[{"id":"E11_s0","startPoint":{"x":418.0,"y":55.0},"endPoint":{"x":446.0,"y":55.0},"incomingShape":"P24","outgoingShape":"P3"}],"container":"G1"},{"id":"E12","sources":["P25"],"targets":["P23"],"sections":[{"id":"E12_s0","startPoint":{"x":359.0,"y":55.0},"endPoint":{"x":381.0,"y":55.0},"incomingShape":"P25","outgoingShape":"P23"}],"container":"G1"}]}

perf/model_parity_tests/report.md

## Drift Samples

- `tests/core/label_placement/port_labels/next_to_port_if_possible_inside.elkt`: diffs=5 [coordinate=4, other=1], first: children[0]/ports[0]/x: number mismatch (4.0 != 24.0)
- `tests/core/label_placement/port_labels/treat_as_group_outside.elkt`: diffs=4 [label=2, coordinate=1, other=1], first: children[0]/height: number mismatch (30.0 != 20.0)
- `tests/core/label_placement/port_labels/variants.elkt`: diffs=20 [coordinate=13, section=4, label=3], first: children[0]/children[0]/x: number mismatch (12.0 != 36.0)
- `tests/core/node_size/inside_port_labels.elkt`: diffs=16 [coordinate=14, label=1, other=1], first: children[0]/height: number mismatch (64.0 != 0.0)
- `tests/layered/compaction_oned/hierarchical_ports/hports1.elkt`: diffs=20 [section=12, coordinate=4, label=4], first: children[0]/children[0]/x: number mismatch (32.0 != 52.0)
- `tests/layered/compaction_oned/labels/edgeLabelAndSplines.elkt`: diffs=20 [section=8, coordinate=6, label=4, ordering=2], first: children[0]/y: number mismatch (20.5 != 19.0)
- `tests/layered/compaction_oned/labels/edgeLabelShouldBeCentered.elkt`: diffs=12 [section=6, coordinate=3, label=2, ordering=1], first: children[0]/y: number mismatch (32.66666666666667 != 15.333333333333334)
- `tests/layered/compaction_oned/labels/edgeLabelSideSelection01.elkt`: diffs=16 [section=8, coordinate=4, label=3, other=1], first: children[0]/y: number mismatch (15.0 != 12.0)
- `tests/layered/compaction_oned/labels/labels1.elkt`: diffs=20 [coordinate=12, section=4, label=3, ordering=1], first: children[0]/x: number mismatch (305.0 != 340.0)
- `tests/layered/compaction_oned/labels/labels2.elkt`: diffs=20 [coordinate=9, section=6, label=4, ordering=1], first: children[0]/x: number mismatch (554.0 != 1021.0)
- `tests/layered/compaction_oned/nsport/south_port.elkt`: diffs=4 [section=2, coordinate=1, other=1], first: children[2]/x: number mismatch (41.3333 != 61.3333)
- `tests/layered/compaction_oned/selfloop/selfloop_crash.elkt`: diffs=20 [section=12, coordinate=6, ordering=2], first: children[0]/y: number mismatch (73.0 != 72.0)
- `tests/layered/compaction_oned/selfloop/selfloop_orthogonal.elkt`: diffs=16 [section=10, coordinate=4, structure=2], first: children[0]/y: number mismatch (42.0 != 12.0)
- `tests/layered/compaction_oned/selfloop/selfloop_spline.elkt`: diffs=20 [section=11, coordinate=6, ordering=3], first: children[0]/y: number mismatch (43.0 != 12.0)
- `tests/layered/compaction_oned/splines/moreThanOneStraightSegmentPath.elkt`: diffs=20 [coordinate=15, section=5], first: children[0]/y: number mismatch (77.5 != 72.5)
- `tests/layered/compaction_oned/splines/moreThanOneStraightSegmentPath2.elkt`: diffs=20 [section=11, coordinate=9], first: children[1]/x: number mismatch (52.0 != 32.0)
- `tests/layered/connected_components/all_four_port_sides.elkt`: diffs=20 [section=12, coordinate=4, structure=4], first: children[0]/children[1]/x: number mismatch (62.0 != 52.0)
- `tests/layered/connected_components/compound02.elkt`: diffs=20 [section=12, coordinate=8], first: children[0]/children[0]/x: number mismatch (12.0 != 34.5)
- `tests/layered/connected_components/compound03.elkt`: diffs=20 [coordinate=20], first: children[0]/children[0]/y: number mismatch (22.0 != 12.0)
- `tests/layered/connected_components/compound04.elkt`: diffs=20 [section=10, coordinate=6, structure=4], first: children[0]/children[1]/x: number mismatch (122.0 != 82.0)