perf/model_parity_full/java/layout/realworld/ptolemy/hierarchical/sr_guardedcount_GuardedCount.elkg.json

{"id":"G1","children":[{"id":"N1","labels":[{"text":"DisplayCount","id":"L1","x":0.0,"y":-20.0,"width":77.0,"height":15.0}],"ports":[{"id":"P1","layoutOptions":{"org.eclipse.elk.port.side":"WEST","org.eclipse.elk.port.index":"0"},"x":-8.0,"y":11.5,"width":8.0,"height":8.0}],"layoutOptions":{"org.eclipse.elk.portConstraints":"FIXED_ORDER","org.eclipse.elk.nodeLabels.placement":"[H_LEFT, V_TOP, OUTSIDE]"},"x":840.0,"y":237.0,"width":41.0,"height":31.0},{"id":"N2","labels":[{"text":"CountDown","id":"L2","x":0.0,"y":-20.0,"width":67.0,"height":15.0}],"ports":[{"id":"P2","layoutOptions":{"org.eclipse.elk.port.side":"WEST","org.eclipse.elk.port.index":"0"},"x":-8.0,"y":106.83333333333334,"width":8.0,"height":8.0},{"id":"P3","layoutOptions":{"org.eclipse.elk.port.side":"EAST","org.eclipse.elk.port.index":"1"},"x":357.0,"y":206.5,"width":8.0,"height":8.0},{"id":"P4","layoutOptions":{"org.eclipse.elk.port.side":"EAST","org.eclipse.elk.port.index":"2"},"x":357.0,"y":47.0,"width":8.0,"height":8.0}],"children":[{"id":"N3","labels":[{"text":"Default","id":"L3","x":0.0,"y":-20.0,"width":40.0,"height":15.0}],"ports":[{"id":"P5","layoutOptions":{"org.eclipse.elk.port.side":"WEST","org.eclipse.elk.port.index":"0"},"x":-8.0,"y":8.0,"width":8.0,"height":8.0},{"id":"P6","layoutOptions":{"org.eclipse.elk.port.side":"WEST","org.eclipse.elk.port.index":"-1"},"x":-8.0,"y":24.0,"width":8.0,"height":8.0},{"id":"P7","layoutOptions":{"org.eclipse.elk.port.side":"EAST","org.eclipse.elk.port.index":"2"},"x":60.0,"y":16.0,"width":8.0,"height":8.0}],"layoutOptions":{"org.eclipse.elk.portConstraints":"FIXED_ORDER","org.eclipse.elk.nodeLabels.placement":"[H_LEFT, V_TOP, OUTSIDE]"},"x":40.0,"y":98.83333333333334,"width":60.0,"height":40.0},{"id":"N4","labels":[{"text":"Const","id":"L4","x":0.0,"y":-20.0,"width":34.0,"height":15.0}],"ports":[{"id":"P8","layoutOptions":{"org.eclipse.elk.port.side":"EAST","org.eclipse.elk.port.index":"0"},"x":18.0,"y":8.5,"width":8.0,"height":8.0},{"id":"P9","layoutOptions":{"org.eclipse.elk.port.side":"WEST","org.eclipse.elk.port.index":"-1"},"x":-8.0,"y":8.5,"width":8.0,"height":8.0}],"layoutOptions":{"org.eclipse.elk.portConstraints":"FIXED_ORDER","org.eclipse.elk.nodeLabels.placement":"[H_LEFT, V_TOP, OUTSIDE]"},"x":136.0,"y":32.0,"width":18.0,"height":25.0},{"id":"N5","labels":[{"text":"AddSubtract","id":"L5","x":0.0,"y":-20.0,"width":72.0,"height":15.0}],"ports":[{"id":"P10","layoutOptions":{"org.eclipse.elk.port.side":"WEST","org.eclipse.elk.port.index":"0"},"x":-8.0,"y":8.333333333333334,"width":8.0,"height":8.0},{"id":"P11","layoutOptions":{"org.eclipse.elk.port.side":"WEST","org.eclipse.elk.port.index":"-1"},"x":-8.0,"y":24.66666666666667,"width":8.0,"height":8.0},{"id":"P12","layoutOptions":{"org.eclipse.elk.port.side":"EAST","org.eclipse.elk.port.index":"2"},"x":41.0,"y":16.5,"width":8.0,"height":8.0}],"layoutOptions":{"org.eclipse.elk.portConstraints":"FIXED_ORDER","org.eclipse.elk.nodeLabels.placement":"[H_LEFT, V_TOP, OUTSIDE]"},"x":251.0,"y":106.5,"width":41.0,"height":41.0},{"id":"N6","labels":[{"text":"Const2","id":"L6","x":0.0,"y":-20.0,"width":42.0,"height":15.0}],"ports":[{"id":"P13","layoutOptions":{"org.eclipse.elk.port.side":"EAST","org.eclipse.elk.port.index":"0"},"x":18.0,"y":8.5,"width":8.0,"height":8.0},{"id":"P14","layoutOptions":{"org.eclipse.elk.port.side":"WEST","org.eclipse.elk.port.index":"-1"},"x":-8.0,"y":8.5,"width":8.0,"height":8.0}],"layoutOptions":{"org.eclipse.elk.portConstraints":"FIXED_ORDER","org.eclipse.elk.nodeLabels.placement":"[H_LEFT, V_TOP, OUTSIDE]"},"x":136.0,"y":171.33333333333334,"width":18.0,"height":25.0},{"id":"N7","labels":[{"text":"NonStrictDelay","id":"L7","x":0.0,"y":-20.0,"width":87.0,"height":15.0}],"ports":[{"id":"P15","layoutOptions":{"org.eclipse.elk.port.side":"WEST","org.eclipse.elk.port.index":"0"},"x":-8.0,"y":8.5,"width":8.0,"height":8.0},{"id":"P16","layoutOptions":{"org.eclipse.elk.port.side":"EAST","org.eclipse.elk.port.index":"1"},"x":18.0,"y":8.5,"width":8.0,"height":8.0}],"layoutOptions":{"org.eclipse.elk.portConstraints":"FIXED_ORDER","org.eclipse.elk.nodeLabels.placement":"[H_LEFT, V_TOP, OUTSIDE]"},"x":136.0,"y":106.33333333333334,"width":18.0,"height":25.0},{"id":"N8","labels":[{"text":"Comparator","id":"L8","x":0.0,"y":-20.0,"width":68.0,"height":15.0}],"ports":[{"id":"P17","layoutOptions":{"org.eclipse.elk.port.side":"WEST","org.eclipse.elk.port.index":"0"},"x":-8.0,"y":5.0,"width":8.0,"height":8.0},{"id":"P18","layoutOptions":{"org.eclipse.elk.port.side":"WEST","org.eclipse.elk.port.index":"-1"},"x":-8.0,"y":18.0,"width":8.0,"height":8.0},{"id":"P19","layoutOptions":{"org.eclipse.elk.port.side":"EAST","org.eclipse.elk.port.index":"2"},"x":61.0,"y":11.5,"width":8.0,"height":8.0}],"layoutOptions":{"org.eclipse.elk.portConstraints":"FIXED_ORDER","org.eclipse.elk.nodeLabels.placement":"[H_LEFT, V_TOP, OUTSIDE]"},"x":252.66666666666666,"y":35.5,"width":61.0,"height":31.0},{"id":"N9","labels":[{"text":"When","id":"L9","x":0.0,"y":-20.0,"width":35.0,"height":15.0}],"ports":[{"id":"P20","layoutOptions":{"org.eclipse.elk.port.side":"WEST","org.eclipse.elk.port.index":"0"},"x":-8.0,"y":19.0,"width":8.0,"height":8.0},{"id":"P21","layoutOptions":{"org.eclipse.elk.port.side":"EAST","org.eclipse.elk.port.index":"1"},"x":66.0,"y":19.0,"width":8.0,"height":8.0},{"id":"P22","layoutOptions":{"org.eclipse.elk.port.side":"SOUTH","org.eclipse.elk.port.index":"-2"},"x":29.0,"y":46.0,"width":8.0,"height":8.0}],"layoutOptions":{"org.eclipse.elk.portConstraints":"FIXED_ORDER","org.eclipse.elk.nodeLabels.placement":"[H_LEFT, V_TOP, OUTSIDE]"},"x":251.0,"y":187.5,"width":66.0,"height":46.0},{"id":"N10","labels":[{"text":"Comparator2","id":"L10","x":0.0,"y":-20.0,"width":75.0,"height":15.0}],"ports":[{"id":"P23","layoutOptions":{"org.eclipse.elk.port.side":"WEST","org.eclipse.elk.port.index":"0"},"x":-8.0,"y":5.0,"width":8.0,"height":8.0},{"id":"P24","layoutOptions":{"org.eclipse.elk.port.side":"WEST","org.eclipse.elk.port.index":"-1"},"x":-8.0,"y":18.0,"width":8.0,"height":8.0},{"id":"P25","layoutOptions":{"org.eclipse.elk.port.side":"EAST","org.eclipse.elk.port.index":"2"},"x":61.0,"y":11.5,"width":8.0,"height":8.0}],"layoutOptions":{"org.eclipse.elk.portConstraints":"FIXED_ORDER","org.eclipse.elk.nodeLabels.placement":"[H_LEFT, V_TOP, OUTSIDE]"},"x":142.0,"y":241.5,"width":61.0,"height":31.0},{"id":"N11","labels":[{"text":"Const3","id":"L11","x":0.0,"y":-20.0,"width":42.0,"height":15.0}],"ports":[{"id":"P26","layoutOptions":{"org.eclipse.elk.port.side":"EAST","org.eclipse.elk.port.index":"0"},"x":18.0,"y":8.5,"width":8.0,"height":8.0},{"id":"P27","layoutOptions":{"org.eclipse.elk.port.side":"WEST","org.eclipse.elk.port.index":"-1"},"x":-8.0,"y":8.5,"width":8.0,"height":8.0}],"layoutOptions":{"org.eclipse.elk.portConstraints":"FIXED_ORDER","org.eclipse.elk.nodeLabels.placement":"[H_LEFT, V_TOP, OUTSIDE]"},"x":66.0,"y":251.0,"width":18.0,"height":25.0}],"layoutOptions":{"org.eclipse.elk.portConstraints":"FREE","org.eclipse.elk.nodeLabels.placement":"[H_LEFT, V_TOP, OUTSIDE]"},"x":447.0,"y":42.0,"width":357.0,"height":299.0,"edges":[{"id":"E5","sources":["P2"],"targets":["P5"],"sections":[{"id":"E5_s0","startPoint":{"x":0.0,"y":110.83333333333334},"endPoint":{"x":32.0,"y":110.83333333333334},"incomingShape":"P2","outgoingShape":"P5"}],"container":"N2"},{"id":"E6","sources":["P7"],"targets":["P15"],"sections":[{"id":"E6_s0","startPoint":{"x":108.0,"y":118.83333333333334},"endPoint":{"x":128.0,"y":118.83333333333334},"incomingShape":"P7","outgoingShape":"P15"}],"container":"N2"},{"id":"E7","sources":["P7"],"targets":["P20"],"sections":[{"id":"E7_s0","startPoint":{"x":108.0,"y":118.83333333333334},"endPoint":{"x":243.0,"y":210.5},"bendPoints":[{"x":118.0,"y":118.83333333333334},{"x":118.0,"y":210.5}],"incomingShape":"P7","outgoingShape":"P20"}],"junctionPoints":[{"x":118.0,"y":118.83333333333334},{"x":118.0,"y":210.5}],"container":"N2"},{"id":"E8","sources":["P7"],"targets":["P23"],"sections":[{"id":"E8_s0","startPoint":{"x":108.0,"y":118.83333333333334},"endPoint":{"x":134.0,"y":250.5},"bendPoints":[{"x":118.0,"y":118.83333333333334},{"x":118.0,"y":250.5}],"incomingShape":"P7","outgoingShape":"P23"}],"container":"N2"},{"id":"E9","sources":["P8"],"targets":["P17"],"sections":[{"id":"E9_s0","startPoint":{"x":162.0,"y":44.5},"endPoint":{"x":244.66666666666666,"y":44.5},"incomingShape":"P8","outgoingShape":"P17"}],"container":"N2"},{"id":"E10","sources":["P12"],"targets":["P6"],"sections":[{"id":"E10_s0","startPoint":{"x":300.0,"y":127.0},"endPoint":{"x":32.0,"y":126.83333333333334},"bendPoints":[{"x":335.0,"y":127.0},{"x":335.0,"y":286.0},{"x":22.0,"y":286.0},{"x":22.0,"y":126.83333333333334}],"incomingShape":"P12","outgoingShape":"P6"}],"container":"N2"},{"id":"E11","sources":["P13"],"targets":["P11"],"sections":[{"id":"E11_s0","startPoint":{"x":162.0,"y":183.83333333333334},"endPoint":{"x":243.0,"y":135.16666666666669},"bendPoints":[{"x":233.0,"y":183.83333333333334},{"x":233.0,"y":135.16666666666669}],"incomingShape":"P13","outgoingShape":"P11"}],"container":"N2"},{"id":"E12","sources":["P16"],"targets":["P10"],"sections":[{"id":"E12_s0","startPoint":{"x":162.0,"y":118.83333333333334},"endPoint":{"x":243.0,"y":118.83333333333333},"incomingShape":"P16","outgoingShape":"P10"}],"container":"N2"},{"id":"E13","sources":["P16"],"targets":["P18"],"sections":[{"id":"E13_s0","startPoint":{"x":162.0,"y":118.83333333333334},"endPoint":{"x":244.66666666666666,"y":57.5},"bendPoints":[{"x":233.0,"y":118.83333333333334},{"x":233.0,"y":57.5}],"incomingShape":"P16","outgoingShape":"P18"}],"junctionPoints":[{"x":233.0,"y":118.83333333333334}],"container":"N2"},{"id":"E14","sources":["P19"],"targets":["P4"],"sections":[{"id":"E14_s0","startPoint":{"x":321.66666666666663,"y":51.0},"endPoint":{"x":357.0,"y":51.0},"incomingShape":"P19","outgoingShape":"P4"}],"container":"N2"},{"id":"E15","sources":["P21"],"targets":["P3"],"sections":[{"id":"E15_s0","startPoint":{"x":325.0,"y":210.5},"endPoint":{"x":357.0,"y":210.5},"incomingShape":"P21","outgoingShape":"P3"}],"container":"N2"},{"id":"E16","sources":["P25"],"targets":["P22"],"sections":[{"id":"E16_s0","startPoint":{"x":211.0,"y":257.0},"endPoint":{"x":284.0,"y":241.5},"bendPoints":[{"x":284.0,"y":257.0}],"incomingShape":"P25","outgoingShape":"P22"}],"container":"N2"},{"id":"E17","sources":["P26"],"targets":["P24"],"sections":[{"id":"E17_s0","startPoint":{"x":92.0,"y":263.5},"endPoint":{"x":134.0,"y":263.5},"incomingShape":"P26","outgoingShape":"P24"}],"container":"N2"}]},{"id":"N12","labels":[{"text":"DisplayEnable","id":"L12","x":0.0,"y":-20.0,"width":84.0,"height":15.0}],"ports":[{"id":"P28","layoutOptions":{"org.eclipse.elk.port.side":"WEST","org.eclipse.elk.port.index":"0"},"x":-8.0,"y":11.5,"width":8.0,"height":8.0}],"layoutOptions":{"org.eclipse.elk.portConstraints":"FIXED_ORDER","org.eclipse.elk.nodeLabels.placement":"[H_LEFT, V_TOP, OUTSIDE]"},"x":840.0,"y":77.5,"width":41.0,"height":31.0},{"id":"N13","labels":[{"text":"EnabledComposite","id":"L13","x":0.0,"y":-20.0,"width":110.0,"height":15.0}],"ports":[{"id":"P29","layoutOptions":{"org.eclipse.elk.port.side":"SOUTH","org.eclipse.elk.port.index":"0"},"x":-8.0,"y":12.0,"width":8.0,"height":8.0},{"id":"P30","layoutOptions":{"org.eclipse.elk.port.side":"EAST","org.eclipse.elk.port.index":"2"},"x":381.0,"y":69.0,"width":8.0,"height":8.0}],"children":[{"id":"N14","labels":[{"text":"Sequence","id":"L14","x":0.0,"y":-20.0,"width":59.0,"height":15.0}],"ports":[{"id":"P31","layoutOptions":{"org.eclipse.elk.port.side":"WEST","org.eclipse.elk.port.index":"0"},"x":-8.0,"y":10.5,"width":8.0,"height":8.0},{"id":"P32","layoutOptions":{"org.eclipse.elk.port.side":"EAST","org.eclipse.elk.port.index":"1"},"x":66.0,"y":10.5,"width":8.0,"height":8.0}],"layoutOptions":{"org.eclipse.elk.portConstraints":"FIXED_ORDER","org.eclipse.elk.nodeLabels.placement":"[H_LEFT, V_TOP, OUTSIDE]"},"x":20.0,"y":33.0,"width":66.0,"height":29.0},{"id":"N15","labels":[{"text":"DisplayCountRequests","id":"L15","x":0.0,"y":-20.0,"width":132.0,"height":15.0}],"ports":[{"id":"P33","layoutOptions":{"org.eclipse.elk.port.side":"WEST","org.eclipse.elk.port.index":"0"},"x":-8.0,"y":11.5,"width":8.0,"height":8.0}],"layoutOptions":{"org.eclipse.elk.portConstraints":"FIXED_ORDER","org.eclipse.elk.nodeLabels.placement":"[H_LEFT, V_TOP, OUTSIDE]"},"x":237.0,"y":32.0,"width":41.0,"height":31.0},{"id":"N16","labels":[{"text":"NonStrictDelay","id":"L16","x":0.0,"y":-20.0,"width":87.0,"height":15.0}],"ports":[{"id":"P34","layoutOptions":{"org.eclipse.elk.port.side":"WEST","org.eclipse.elk.port.index":"0"},"x":-8.0,"y":8.5,"width":8.0,"height":8.0},{"id":"P35","layoutOptions":{"org.eclipse.elk.port.side":"EAST","org.eclipse.elk.port.index":"1"},"x":18.0,"y":8.5,"width":8.0,"height":8.0}],"layoutOptions":{"org.eclipse.elk.portConstraints":"FIXED_ORDER","org.eclipse.elk.nodeLabels.placement":"[H_LEFT, V_TOP, OUTSIDE]"},"x":122.0,"y":35.0,"width":18.0,"height":25.0}],"layoutOptions":{"org.eclipse.elk.portConstraints":"FREE","org.eclipse.elk.nodeLabels.placement":"[H_LEFT, V_TOP, OUTSIDE]"},"x":30.0,"y":79.83333333333334,"width":381.0,"height":89.0,"edges":[{"id":"E18","sources":["P32"],"targets":["P34"],"sections":[{"id":"E18_s0","startPoint":{"x":94.0,"y":47.5},"endPoint":{"x":114.0,"y":47.5},"incomingShape":"P32","outgoingShape":"P34"}],"container":"N13"},{"id":"E19","sources":["P35"],"targets":["P30"],"sections":[{"id":"E19_s0","startPoint":{"x":148.0,"y":47.5},"endPoint":{"x":381.0,"y":73.0},"bendPoints":[{"x":219.0,"y":47.5},{"x":219.0,"y":73.0}],"incomingShape":"P35","outgoingShape":"P30"}],"junctionPoints":[{"x":219.0,"y":47.5}],"container":"N13"},{"id":"E20","sources":["P35"],"targets":["P33"],"sections":[{"id":"E20_s0","startPoint":{"x":148.0,"y":47.5},"endPoint":{"x":229.0,"y":47.5},"incomingShape":"P35","outgoingShape":"P33"}],"container":"N13"}]}],"layoutOptions":{"org.eclipse.elk.portConstraints":"FREE","org.eclipse.elk.randomSeed":"1"},"x":0.0,"y":0.0,"width":936.0,"height":353.0,"edges":[{"id":"E1","sources":["P4"],"targets":["P28"],"sections":[{"id":"E1_s0","startPoint":{"x":812.0,"y":93.0},"endPoint":{"x":832.0,"y":93.0},"incomingShape":"P4","outgoingShape":"P28"}],"container":"G1"},{"id":"E2","sources":["P4"],"targets":["P29"],"sections":[{"id":"E2_s0","startPoint":{"x":812.0,"y":93.0},"endPoint":{"x":22.0,"y":95.83333333333334},"bendPoints":[{"x":822.0,"y":93.0},{"x":822.0,"y":12.0},{"x":12.0,"y":12.0},{"x":12.0,"y":95.83333333333334}],"incomingShape":"P4","outgoingShape":"P29"}],"junctionPoints":[{"x":822.0,"y":93.0}],"container":"G1"},{"id":"E3","sources":["P3"],"targets":["P1"],"sections":[{"id":"E3_s0","startPoint":{"x":812.0,"y":252.5},"endPoint":{"x":832.0,"y":252.5},"incomingShape":"P3","outgoingShape":"P1"}],"container":"G1"},{"id":"E4","sources":["P30"],"targets":["P2"],"sections":[{"id":"E4_s0","startPoint":{"x":419.0,"y":152.83333333333334},"endPoint":{"x":439.0,"y":152.83333333333334},"incomingShape":"P30","outgoingShape":"P2"}],"container":"G1"}]}

perf/model_parity_tests/report.md

### Top Diff Path Prefixes

- `children[*]/y`: 469 (20.5%)
- `children[*]/edges[*]/sections[*]`: 277 (12.1%)
- `edges[*]/sections[*]/endPoint`: 276 (12.0%)
- `edges[*]/sections[*]/bendPoints[*]`: 241 (10.5%)
- `edges[*]/sections[*]/startPoint`: 237 (10.3%)
- `children[*]/x`: 151 (6.6%)
- `edges[*]/labels[*]/y`: 119 (5.2%)
- `children[*]/ports[*]/x`: 93 (4.1%)
- `children[*]/children[*]/y`: 62 (2.7%)
- `edges[*]/sections[*]/bendPoints`: 60 (2.6%)

## Drift Samples

- `tests/core/label_placement/port_labels/next_to_port_if_possible_inside.elkt`: diffs=5 [coordinate=4, other=1], first: children[0]/ports[0]/x: number mismatch (4.0 != 24.0)
- `tests/core/label_placement/port_labels/treat_as_group_outside.elkt`: diffs=4 [label=2, coordinate=1, other=1], first: children[0]/height: number mismatch (30.0 != 20.0)
- `tests/core/label_placement/port_labels/variants.elkt`: diffs=20 [coordinate=13, section=4, label=3], first: children[0]/children[0]/x: number mismatch (12.0 != 36.0)
- `tests/core/node_size/inside_port_labels.elkt`: diffs=16 [coordinate=14, label=1, other=1], first: children[0]/height: number mismatch (64.0 != 0.0)
- `tests/layered/compaction_oned/hierarchical_ports/hports1.elkt`: diffs=20 [section=12, coordinate=4, label=4], first: children[0]/children[0]/x: number mismatch (32.0 != 52.0)
- `tests/layered/compaction_oned/labels/edgeLabelAndSplines.elkt`: diffs=20 [section=8, coordinate=6, label=4, ordering=2], first: children[0]/y: number mismatch (20.5 != 19.0)
- `tests/layered/compaction_oned/labels/edgeLabelShouldBeCentered.elkt`: diffs=12 [section=6, coordinate=3, label=2, ordering=1], first: children[0]/y: number mismatch (32.66666666666667 != 15.333333333333334)
- `tests/layered/compaction_oned/labels/edgeLabelSideSelection01.elkt`: diffs=16 [section=8, coordinate=4, label=3, other=1], first: children[0]/y: number mismatch (15.0 != 12.0)
- `tests/layered/compaction_oned/labels/labels1.elkt`: diffs=20 [coordinate=12, section=4, label=3, ordering=1], first: children[0]/x: number mismatch (305.0 != 340.0)
- `tests/layered/compaction_oned/labels/labels2.elkt`: diffs=20 [coordinate=9, section=6, label=4, ordering=1], first: children[0]/x: number mismatch (554.0 != 1021.0)
- `tests/layered/compaction_oned/nsport/south_port.elkt`: diffs=4 [section=2, coordinate=1, other=1], first: children[2]/x: number mismatch (41.3333 != 61.3333)
- `tests/layered/compaction_oned/selfloop/selfloop_crash.elkt`: diffs=20 [section=12, coordinate=6, ordering=2], first: children[0]/y: number mismatch (73.0 != 72.0)
- `tests/layered/compaction_oned/selfloop/selfloop_orthogonal.elkt`: diffs=16 [section=10, coordinate=4, structure=2], first: children[0]/y: number mismatch (42.0 != 12.0)
- `tests/layered/compaction_oned/selfloop/selfloop_spline.elkt`: diffs=20 [section=11, coordinate=6, ordering=3], first: children[0]/y: number mismatch (43.0 != 12.0)
- `tests/layered/compaction_oned/splines/moreThanOneStraightSegmentPath.elkt`: diffs=20 [coordinate=15, section=5], first: children[0]/y: number mismatch (77.5 != 72.5)
- `tests/layered/compaction_oned/splines/moreThanOneStraightSegmentPath2.elkt`: diffs=20 [section=11, coordinate=9], first: children[1]/x: number mismatch (52.0 != 32.0)
- `tests/layered/connected_components/all_four_port_sides.elkt`: diffs=20 [section=12, coordinate=4, structure=4], first: children[0]/children[1]/x: number mismatch (62.0 != 52.0)
- `tests/layered/connected_components/compound02.elkt`: diffs=20 [section=12, coordinate=8], first: children[0]/children[0]/x: number mismatch (12.0 != 34.5)
- `tests/layered/connected_components/compound03.elkt`: diffs=20 [coordinate=20], first: children[0]/children[0]/y: number mismatch (22.0 != 12.0)
- `tests/layered/connected_components/compound04.elkt`: diffs=20 [section=10, coordinate=6, structure=4], first: children[0]/children[1]/x: number mismatch (122.0 != 82.0)